ID,Name,Incident Type,Status,Severity,Summary,Incident Manager,Reporter,Comms Lead,IM SLT,Tech Lead,Impacted Platform,Impacted Client(s),Resolution (Fix) ,Impact ,Fault Responsibility,Zoom Meeting Link,VoucherEngine Component,Root Cause Analysis Summary,Repeat Incident,Monitoring,Detection & Triage,Investigation & Resolution,Client Communication,Affected services,Environment Type,Post-Mortem Document,Created At,Reported at,Accepted at,Declined at,Merged at,Canceled at,Resolved at,Impact started at,Identified at,Fixed at,Documented at,Reviewed at,Closed at,Incident duration,Updated At,Creator Alert ID,Visibility,Workload Total (minutes),Workload In Working Hours (minutes),Workload In Late Hours (minutes),Workload In Sleeping Hours (minutes),Channel name,Channel link,Source,Opted out of post-incident flow
18,"API calls  - Customers are not able to access the service like card details, balance, and others",Service Incident,Closed,P1,"Customers are not able to access the service like card details, balance, and others",Snothile Dlamini,Vicnesh Baskar,,,,VoucherEngine,Vodacom Tanzania,Unknown (fix implemented by client),"Customers are not able to access the service like card details, balance, and others",,,,,,,,,,,,,2024-12-18T05:34:44.546Z,2024-12-18T05:34:44.546Z,,,,,2024-12-18T11:37:12.854Z,2024-12-17T12:40:00.000Z,2024-12-18T11:37:12.854Z,,,,2024-12-18T11:37:12.854Z,21748,2024-12-18T11:37:13.035Z,,public,219.7,207.6,0,12.1,18dec-p1-critical-18-api-calls-customers-are-not-able-to-access-the-service,https://slack.com/app_redirect?team=T03SMJWS8&channel=C085HLCDV5K,Reported by Vicnesh Baskar,false
24,No Transactions processing for C24,Service Incident,Closed,P1,No actions taken by PTY. Issue to be investigated with Pulsant and MC,Snothile Dlamini,Snothile Dlamini,,,,Banking.Live,"C24, Gnosis, Coverflex",,,TBD,,,,,,,,,,,,2024-12-19T12:23:35.135Z,2024-12-19T12:23:35.135Z,,,,,2024-12-19T13:21:24.307Z,2024-12-19T12:11:00.000Z,2024-12-19T12:39:13.986Z,2024-12-19T13:21:24.307Z,,,2024-12-19T13:21:24.307Z,3469,2024-12-19T13:50:33.255Z,,public,733.2,537.9,165.4,30,19dec-p1-critical-24-no-transactions-processing-for-c24,https://slack.com/app_redirect?team=T03SMJWS8&channel=C085UAXT3FD,Reported by Snothile Dlamini,false
27,Intermittent transaction timeout,Service Incident,Closed,P2,"AS to further investigate the 09 second delay in Rule Engine, causing the timeouts. ",Snothile Dlamini,Snothile Dlamini,,,,Banking.Live,"Nomo Bank, Utility Warehouse",None,BB2: 12 failed transactions 87 successful transactions UWH 115 failed transactions 792 successful transactions,,,,,,,,,,,,,2024-12-20T12:58:36.418Z,2024-12-20T10:30:00.000Z,,,,,2024-12-20T10:30:00.000Z,2024-12-20T10:27:00.000Z,2024-12-20T10:30:00.000Z,,,,2024-12-20T10:59:00.000Z,,2024-12-20T13:01:48.570Z,,public,86.3,68.7,17.6,0,20dec-p2-high-27-intermittent-transaction-timeout,https://slack.com/app_redirect?team=T03SMJWS8&channel=C0860F503K5,Reported by Snothile Dlamini,false
28,Partial Outage on Transaction Processing for UW,Service Incident,Closed,P2,"There was a brief interruption to transaction processing (partial outage) from 10:31 UTC to 10:32 UTC on 24th Dec. 60 failed transactions / 150 successful transactions. Issue resolved itself, no action taken by any support team.  Currently transactions are processing as expected with no issues. AS team is investigating further to identify the root cause of the issue, suspected it is related to rules engine taking longer than normal. Monitoring ongoing. ",Kaisar Mahmood,Kaisar Mahmood,,,,Banking.Live,Utility Warehouse,No Action taken by any support team. Issue resolved itself.,Partial Outage on Transaction Processing  ,Paymentology,,,,,,,,,,,,2024-12-24T11:27:58.898Z,2024-12-24T11:27:58.898Z,,,,,2024-12-24T11:30:35.237Z,2024-12-24T02:31:00.000Z,2024-12-24T11:30:35.237Z,,,,2024-12-24T11:30:35.237Z,156,2024-12-24T11:30:35.468Z,,public,96.3,54.7,41.6,0,24dec-p2-high-28-partial-outage-on-transaction-processing-for-uw,https://slack.com/app_redirect?team=T03SMJWS8&channel=C086AA66MKP,Reported by Kaisar Mahmood,false
29,Partial Outage of Transaction Processing for D360 ,Service Incident,Closed,P1,Marking the incident as closed. Issue was resolved on 5th Jan. Incident Report (IR) and RCA Report (RCAR) have already been shared with the client.,Kaisar Mahmood,Kaisar Mahmood,,,,Banking.Live,D360,Final fix implementation to restore service was completed at 14:55 UTC on 5th January. Problematic DNS server name entries were removed from system configurations on the Primary and Secondary PayPower application servers.,D360 has been observing a partial outage on transaction processing since 29th Dec 2024. We have not hit processing SLA since 29th Dec. Specially from 12:45 AM UTC 3rd Jan to 10:25 AM UTC 3rd Jan we have received 13495 (1200 - MADA transaction). In that 107 transaction are identified as impacted.,Paymentology,,,,,,,,,,,,2025-01-03T10:52:16.705Z,2025-01-03T10:52:16.705Z,,,,,2025-01-10T12:25:49.748Z,2024-12-28T16:00:00.000Z,2025-01-10T12:25:49.748Z,,,,2025-01-10T12:25:49.748Z,610413,2025-01-10T12:25:49.905Z,,public,4462.1,3235.2,710.6,516.2,03jan-p1-critical-29-partial-outage-of-transaction-processing-for-d360,https://slack.com/app_redirect?team=T03SMJWS8&channel=C0878GVS4AG,Reported by Kaisar Mahmood,false
33,SH02 Timeout due to a rule engine delay.,Service Incident,Closed,P3 - Critical,"16-second timeout caused by a rule engine delay between 13:51:00 and 13:51:16 UTC. The clients affected included UW (14 transactions) and BB2 (3 transactions), and the overall impact exceeded 30%, prompting escalation to P1 priority. The root cause is suspected to be related to database contention or background jobs affecting the rule engine's performance. While the issue resolved itself during the initial outage, an investigation is ongoing to determine the exact cause.",Snothile Dlamini,Snothile Dlamini,,,,,"Utility Warehouse, Nomo Bank",None,,Paymentology,,,,,,,,,,,,2025-01-10T08:24:04.731Z,2025-01-09T11:51:00.000Z,,,,,2025-01-09T11:51:00.000Z,2025-01-09T11:51:00.000Z,,,2025-01-10T08:27:52.585Z,2025-01-10T08:31:22.078Z,2025-01-10T08:31:22.078Z,,2025-01-10T09:41:03.495Z,,public,44.2,44.2,0,0,10jan-p3-medium-33-sh02-timeout-due-to-a-rule-engine-delay,https://slack.com/app_redirect?team=T03SMJWS8&channel=C088FUXDWE5,Reported by Snothile Dlamini,true
31,Full Outage of Mastercard Transactions for BOJ ,Service Incident,Closed,P1,"There was a full outage of MC transactions from 11:32 UTC 9th Jan till 11:42 UTC 9th Jan for BOJ. As of 11:42 UTC on 9th Jan we are processing as expected. To restore service, Advanced Support team restarted PayRoute instances. Root cause investigation is in progress. ",Snothile Dlamini,Kaisar Mahmood,,,,Banking.Live,Bank of Jordan,Advanced Support team restarted PayRoute instances,Full outage of Mastercard transactions for BOJ for 10 mins ,Paymentology,,,,,,,,,,,,2025-01-09T11:53:30.478Z,2025-01-09T11:53:30.478Z,,,,,2025-01-09T12:06:58.051Z,2025-01-09T03:32:00.000Z,2025-01-09T12:06:58.051Z,,,,2025-01-09T12:06:58.051Z,807,2025-01-09T12:10:09.567Z,,public,262.8,206.2,56.6,0,09jan-p1-critical-31-full-outage-of-mastercard-transactions-for-boj,https://slack.com/app_redirect?team=T03SMJWS8&channel=C087Y38BQFL,Reported by Kaisar Mahmood,false
32,Partial Outage of Transaction processing for DoPay,Service Incident,Closed,P1,"On 09 Dec 18:35 UTC, the Paymentology support team received an alert from the internal monitoring system that Paymentology was not receiving a response from the AFS (American Financial Services) scheme. The AFS PayRoute application was restarted, and new transactions were observed from 09 Dec 19:06 onwards.",Vicnesh Baskar,Vicnesh Baskar,,,,,Dopay LLC,AFS PayRoute application was restarted,,Third-Party - Client,,,,,,,,,,,,2025-01-10T07:34:26.223Z,2025-01-10T07:34:26.223Z,,,,,2025-01-09T11:06:00.000Z,2025-01-09T10:35:00.000Z,2025-01-09T10:35:00.000Z,2025-10-09T11:05:00.000Z,,,,,2026-02-02T10:34:12.560Z,,public,128.9,102.5,26.4,0,10jan-p1-32-partial-outage-of-transaction-processing-for-dopay,https://slack.com/app_redirect?team=T03SMJWS8&channel=C087NGLJ0B1,Reported by Vicnesh Baskar,false
34,Create Card Stack Issue for MOX ,Service Incident,Closed,P1,Issue resolved at 14:01 UTC on 10th January 2025 after Advanced Support team manually increased the card stack size/limit. In total 26 create card requests were impacted. Monitoring and root cause investigation in progress.,Daniel Velado,Kaisar Mahmood,,,,Banking.Live,MOX,Advanced Support manually increased the card stack size/limit,Create card issue for one product - in total 26 requests were impacted. ,Paymentology,,,,,,,,,,,,2025-01-10T14:09:44.334Z,2025-01-10T14:09:44.334Z,,,,,2025-01-10T14:39:56.352Z,2025-01-10T05:47:00.000Z,2025-01-10T14:39:56.352Z,,,,2025-01-10T14:39:56.352Z,1812,2025-01-10T16:09:32.977Z,,public,410.5,225.4,136.2,48.9,10jan-p1-critical-34-create-card-stack-issue-for-mox,https://slack.com/app_redirect?team=T03SMJWS8&channel=C087Y49LMUN,Reported by Kaisar Mahmood,false
35,PayRoute disconnection from UAE Switch,Service Incident,Closed,P1,"On January 10, from 22:38 to 22:56 UTC, a disconnection occurred between Payroute and the UAE Switch, impacting transaction processing during this period. Although the connection has since been restored and transactions are now processing normally, the exact number of impacted transactions remains unclear due to a lack of advisements. The issue has been escalated as a P1 incident, and investigations are underway with the infrastructure and tooling teams to determine the root cause and prevent recurrence. A Zendesk ticket (#898181) has been created for tracking, and the client has been informed that updates will be provided as more information becomes available.",Snothile Dlamini,Snothile Dlamini,,,,Banking.Live,Wio,,No advisements received for UAE,Third-Party - Client,,,,,,,,,,,,2025-01-11T06:42:11.466Z,2025-01-10T23:36:00.000Z,,,,,2025-01-10T20:56:00.000Z,2025-01-10T20:34:00.000Z,2025-01-11T06:44:47.968Z,,,,2025-01-11T06:44:47.968Z,,2026-02-02T10:35:20.804Z,,public,231.3,152,69.3,10,11jan-p1-35-payroute-disconnection-from-uae-switch,https://slack.com/app_redirect?team=T03SMJWS8&channel=C088LRV3473,Reported by Snothile Dlamini,false
37,Transaction and API Processing Issue,Service Incident,Closed,P1,"An issue was reported with ADQ transaction processing, showing errors and 100% CPU usage on the Paycore database. Paycontrol became unresponsive, prompting a restart of PayPower and PayAPI as a precautionary measure.",Daniel Velado,Snothile Dlamini,,,,Banking.Live,Wio,"Indexes were created on the p_card_wallet_token table to improve transaction processing speeds, and transactions are now processing fine.",,Paymentology,,,,,,,,,,,,2025-01-14T13:26:02.248Z,2025-01-14T11:18:00.000Z,,,,,2025-01-14T11:25:00.000Z,2025-01-14T11:15:00.000Z,2025-01-14T14:16:34.294Z,2025-01-14T14:28:07.280Z,,,2025-01-14T14:28:07.280Z,420,2025-01-14T15:21:24.237Z,,public,558.3,406.1,119.9,32.3,14jan-p1-critical-37-transaction-and-api-processing-issue,https://slack.com/app_redirect?team=T03SMJWS8&channel=C088N6P9KU4,Reported by Snothile Dlamini,false
38,Transaction processing issue on PROD_ALTC_4B.,Service Incident,Post-Incident Tasks & Documentation,P1,No additional errors were observed.,Daniel Velado,Daniel Velado,,,,VoucherEngine,SBSA Virtual Card,Altec to generate a new key on failovers,,Third-Party - Paymentology,,,,,,,,,,,,2025-01-15T15:55:12.195Z,2025-01-15T15:55:12.195Z,,,,,2025-01-15T16:42:01.646Z,2015-01-15T21:47:00.000Z,2025-01-15T16:04:37.421Z,,,,,2809,2025-01-15T16:42:02.542Z,,public,157.7,147.7,0,10,15jan-p1-critical-38-transaction-processing-issue-on-prod_altc_4b,https://slack.com/app_redirect?team=T03SMJWS8&channel=C088SSKD7A7,Reported by Daniel Velado,false
39,Transaction Processing Issue,Service Incident,Closed,P1,"Mastercard sent notifications regarding a transaction issue, and the AS team observed that no transactions were being received for one of the Mastercard PayRoute 4IR channels. The team restarted the PayRoute, which resolved the issue. The RCA is currently under investigation.",Snothile Dlamini,Snothile Dlamini,,,,Banking.Live,Tweeq,,,Third-Party - Paymentology,,,,,,,,,,,,2025-01-20T14:00:31.131Z,2025-01-20T14:00:31.131Z,,,,,2025-01-20T11:35:00.000Z,2025-01-20T08:40:00.000Z,2025-01-20T14:38:08.781Z,,,,2025-01-20T14:38:08.781Z,,2025-01-20T14:38:08.874Z,,public,126.8,115.8,11,0,20jan-p1-critical-39-transaction-processing-issue,https://slack.com/app_redirect?team=T03SMJWS8&channel=C089H8NK8FN,Reported by Snothile Dlamini,false
40,Transaction Processing Issue for OM client,Service Incident,Closed,P1,"Issue has been resolved, Mastercard implemented a fix at 07:40 UTC on 22nd Jan. We can now see successful transactions. Pending for Mastercard to share the full RCA report.",Kaisar Mahmood,Daniel Velado,,,,Banking.Live,Old Mutual Bank / Olympus,Mastercard implemented a fix,,Third-Party - Paymentology,,,,,,,,,,,,2025-01-20T15:19:27.828Z,2025-01-20T15:19:27.828Z,,,,,2025-01-22T11:47:30.417Z,,2025-01-20T20:10:55.771Z,2025-01-22T11:47:30.417Z,,,2025-01-22T11:47:30.417Z,138721,2025-01-22T11:47:30.593Z,,public,1885.1,1603.1,227.6,54.4,20jan-p1-critical-40-transaction-processing-issue-for-om-client,https://slack.com/app_redirect?team=T03SMJWS8&channel=C089F2DHHL3,Reported by Daniel Velado,false
42,Partial Outage of Transaction Processing for BAE,Service Incident,Closed,P1,"1 minute partial outage on transaction processing occurred from 12:49 UTC till 12:50 UTC on 22nd Jan 2025. Disconnection occurred between Paycore DB and PayPower.  Issue resolved itself, no action was taken by any support teams. Transactions are processing fine since 12:50 UTC. Investigation into the root cause of the disconnection is in progress. AS team has raised tickets to DB and Dev team for further investigation.",Kaisar Mahmood,Kaisar Mahmood,,,,Banking.Live,Bank Al Etihad,"Issue resolved itself, no action taken",Partial Outage for 1 minute - 66 transactions successfully processed / 39 transactions failed. ,Paymentology,,,,,,,,,,,,2025-01-22T13:14:20.838Z,2025-01-22T13:14:20.838Z,,,,,2025-01-22T14:21:52.354Z,2025-01-22T04:49:00.000Z,2025-01-22T14:21:52.354Z,,,,2025-01-22T14:21:52.354Z,4051,2025-01-22T14:21:52.601Z,,public,189.1,79.7,109.4,0,22jan-p1-critical-42-partial-outage-of-transaction-processing-for-bae,https://slack.com/app_redirect?team=T03SMJWS8&channel=C089PBHLNVB,Reported by Kaisar Mahmood,false
44,Partial Outage of ATM transaction processing for Mukuru & Nupay,Service Incident,Closed,P1,"On 25 January 2025, at 06:11 UTC, Paymentology’s support team was alerted to an issue where ATM transactions were not disbursing funds while still deducting balances from cardholder accounts.

Upon investigation, the Paymentology system successfully approved transactions but failed to dispense cash at ATMs. The incident affected multiple banks’ ATM networks, with notable issues reported for South African Standard Bank, FNB, and ABSA ATMs. This behaviour was consistent across all reported cases, suggesting an issue downstream in the ATM or acquirer system.

ATM withdrawals started processing normally, with the first confirmation on 25 January at 08:07 UTC. Monitoring confirmed successful transaction processing thereafter. Reversal activity for Mukuru was completed by 29th January and for Nupay by 1st February.

The incident was escalated to both ACS and Mastercard. Mastercard confirmed declines due to system errors (Response Code 96), root cause analysis is currently in progress.

Further updates on corrective actions will be provided in the Root Cause Analysis Report (RCAR).",Vicnesh Baskar,Vicnesh Baskar,,,,VoucherEngine,"Mukuru, Altron FinTech - NuPay",,"ATM transactions for both clients are showing successful, but cash is not dispensed.",Third-Party - Client,,,,,,,,,,,,2025-01-25T08:00:36.055Z,2025-01-25T08:00:36.055Z,,,,,2025-02-05T03:57:19.441Z,,2025-01-25T09:32:36.952Z,,,,2025-02-05T03:57:19.441Z,935803,2026-02-02T10:36:10.312Z,,public,139.8,118.8,21.1,0,25jan-p1-44-partial-outage-of-atm-transaction-processing-for-mukuru-nupay,https://slack.com/app_redirect?team=T03SMJWS8&channel=C08A2HR3AF8,Reported by Vicnesh Baskar,false
45,Partial Outage of transaction processing for D360,Service Incident,Root Cause Analysis and Corrective Actions,P2,"**Problem:** Transactions are intermittently timing out due to FAST Active delay. Rule Engine and Tokenisation delays were also observed for some transactions.

**Impact:** Approximately 21% of transactions experienced timeouts, affecting transaction processing.

**Causes:** To Be Decided

**Steps to resolve:** Restarting MADA & VISA PayPower resolved tokenisation and rule engine delays, and reduced FAST ACTIVE delays. Transactions have been processing normally without further timeouts for the past 60 minutes.",Vicnesh Baskar,Vicnesh Baskar,,,,Banking.Live,D360,Restarting MADA & VISA PayPower,Approximately 20% of transactions in the past 1 hour has been intermittently timing out.,Paymentology,,,,,,,,,,,,2025-01-26T04:35:18.223Z,2025-01-26T04:35:18.223Z,,,,,2025-01-26T06:34:37.024Z,2025-01-25T19:07:00.000Z,2025-01-26T05:33:37.860Z,,2025-01-27T05:37:18.311Z,,,7158,2026-02-02T10:38:32.205Z,,public,707.8,623.1,54.7,30,26jan-p2-45-partial-outage-of-transaction-processing-for-d360,https://slack.com/app_redirect?team=T03SMJWS8&channel=C08AALKUSBD,Reported by Vicnesh Baskar,false
46,MADA Transactions Processing Outage,Service Incident,Closed,P1,All MADA transactions failing for D360 (Visa transactions unaffected) ,Snothile Dlamini,Snothile Dlamini,,,,Banking.Live,D360,,,Inconclusive,,,,,,,,,,,,2025-01-27T11:55:08.075Z,2025-01-27T11:55:08.075Z,,,,,2025-02-12T08:18:50.381Z,2025-01-27T09:32:00.000Z,2025-02-12T08:18:50.381Z,,,,2025-02-12T08:18:50.381Z,1369422,2026-02-02T10:39:12.583Z,,public,1540.5,1208.8,232.4,99.3,27jan-p1-46-mada-transactions-processing-outage,https://slack.com/app_redirect?team=T03SMJWS8&channel=C08ABHXMCNR,Reported by Snothile Dlamini,false
47,Partial Processing Issue,Service Incident,Post-Incident Tasks & Documentation,P1,"**Problem:** Partial processing issues across several VE nodes started at 18:51 UTC.

**Impact:** Customers experienced a significant increase in 9XXX errors, with a success rate dropping to 39.97%.

**Causes:** The issue was caused by AWS-RED-01 and AWS-RED-02 server memory being overwhelmed with large items from different processes.

**Steps to resolve:** The initial investigation led to DB locks, after additional troubleshooting we identified that traffic to AWS-RED-01 and AWS-RED-02 was stopped and the server's memory was manually cleared before restarting them. The traffic was then resumed and it started to show a healthy state across all servers.",Daniel Velado,Daniel Velado,,,,VoucherEngine,,,,Paymentology,,,,,,,,,,,,2025-01-27T19:12:43.899Z,2025-01-27T19:12:43.899Z,,,,,2025-01-27T23:06:16.836Z,2025-01-28T01:00:00.000Z,2025-01-27T22:12:28.716Z,,,,,14012,2025-01-27T23:06:17.692Z,,public,326.9,256.9,50,20,27jan-p1-critical-47-partial-processing-issue,https://slack.com/app_redirect?team=T03SMJWS8&channel=C08AH3JKR42,Reported by Daniel Velado,false
48,Partial Outage of Transaction processing,Service Incident,Closed,P1,"On 29 Jan 22:28 UTC, Paymentology’s support team observed a high number of transaction timeouts affecting ISB, Mettle, and ADQ Mastercard via monitoring alerts. Initial investigations indicated that transactions were delayed before being received by PayRoute, potentially due to an issue between Mastercard/Visa and PayRoute.

Further analysis confirmed no connectivity issues between Azure and the UK data centre. Resource utilisation was stable across PayRoute servers, except for a CPU spike on PR-01 (ISB PayRoute server) during the incident window.

The issue self-recovered by 22:32 UTC, with transaction processing returning to normal. The incident was declared resolved on 29 Jan 22:35 UTC.",Daniel Velado,Vicnesh Baskar,,,,,"Wio, MOX, Mettle, Islandsbanki",The issue self-recovered,,Paymentology,,,,,,,,,,,,2025-01-30T06:11:56.416Z,2025-01-29T22:36:00.000Z,,,,,2025-01-29T22:32:00.000Z,2025-01-29T22:28:00.000Z,,2025-01-29T22:28:00.000Z,,,2025-01-30T06:11:56.416Z,,2025-01-30T06:51:45.325Z,,public,549.7,475.4,40,34.3,30jan-p1-critical-48-partial-outage-of-transaction-processing,https://slack.com/app_redirect?team=T03SMJWS8&channel=C08AHPQKQT1,Reported by Vicnesh Baskar,false
49,Transaction Processing Issue,Service Incident,Post-Incident Tasks & Documentation,P1,"**Problem:** A connection timeout error was encountered with PayRoute and prod-switch.paymentology.org due to the VPN to AFS being down, impacting transaction processing.

**Impact:** This has resulted in a full disruption of transaction processing.

**Causes:** The issue was caused by a failure of the VPN connection to AFS. Additional details will be provided soon.

**Steps to resolve: A call with** AFS took place to resolve their connection issues, and we restarted our application to reconnect. Communication with clients has been maintained, and transactions have started to be processed again.",Daniel Velado,Snothile Dlamini,,,,Banking.Live,Dopay LLC,,,Third-Party - Client,https://paymentology.zoom.us/j/81303225236?pwd=4ZxUdL8c24pMcB0on1MNMp8NEEHBEt.1,,,,,,,,,,,2025-01-30T15:19:06.777Z,2025-01-30T15:19:06.777Z,,,,,2025-01-30T16:17:58.088Z,2025-01-30T12:40:00.000Z,2025-01-30T16:17:58.088Z,,,,,3531,2026-02-02T10:59:38.168Z,,public,242.2,222.2,10,10,30jan-p1-49-transaction-processing-issue,https://slack.com/app_redirect?team=T03SMJWS8&channel=C08AU6KBU0N,Reported by Snothile Dlamini,false
50,PIN Format Errors,Service Incident,Closed,P1,"An alert was triggered indicating an increase in error codes (9120) on the **Crimson system** for the **prod_altc_4b** node, specifically affecting transactions with BIN **533822** (Standard Bank PayCard). The errors were identified as **PIN format errors** (error code **9120**), which occurred due to **out-of-sync keys** between two Altec endpoints.

The root cause was traced to Altec bringing both endpoints (**prod_altc_4b** and **altc_3A**) online simultaneously without properly synchronizing their keys. This caused the **HSM** to fail PIN validation for transactions, as the keys used for encryption and decryption were mismatched. The issue was intermittent, with the alert auto-resolving at times but reoccurring as new transactions triggered the same errors.",Snothile Dlamini,Snothile Dlamini,,,,VoucherEngine,SBSA PayCard,,,Third-Party - Paymentology,,,,,,,,,,,,2025-02-03T12:50:42.394Z,2025-02-03T12:50:42.394Z,,,,,2025-02-03T13:35:14.735Z,2025-02-03T11:03:00.000Z,2025-02-03T12:50:57.570Z,,,,2025-02-03T13:35:14.735Z,2672,2025-02-03T13:35:14.861Z,,public,154.8,154.8,0,0,03feb-p1-critical-50-pin-format-errors,https://slack.com/app_redirect?team=T03SMJWS8&channel=C08BK52KEAY,Reported by Snothile Dlamini,false
52,Partial Outage of Transaction Processing for multiple clients,Service Incident,Closed,P1,"Multiple transactions are processed in StandIn mode due to a high latency on ve-prod-crimson. Databased and application teams mobilized, investigation in progress.",Vicnesh Baskar,Vicnesh Baskar,,,,VoucherEngine,"Agoda, Albo, GoTyme, DolarApp, Fondeadora/Mibo, Ecocash, Vodacom DRC, Vodafone Fiji, Safaricom, Nelo, Paycard Guinea, Octopus, Mascom Botswana, KiplePay, Inswitch, Quicko, Mukuru, SBSA Ucount, Altron FinTech - NuPay",Database team identified and optimized a query which reduced the high latency,Multiple transactions were impacted for multiple clients. Additional details are being gathered.,Paymentology,https://paymentology.zoom.us/j/84356262159?pwd=7yulrAXU28DTKOUokVKDPvKda8uLs4.1,,,,,,,,,,,2025-02-06T04:53:56.877Z,2025-02-06T04:53:56.877Z,,,,,2025-02-06T06:26:54.622Z,,2025-02-06T05:07:05.725Z,,,,2025-02-06T06:26:54.622Z,5577,2025-02-07T08:30:36.057Z,,public,408.7,367.8,0,40.9,06feb-p1-critical-52-partial-outage-of-transaction-processing-for-multiple,https://slack.com/app_redirect?team=T03SMJWS8&channel=C08C0PT8V6E,Reported by Vicnesh Baskar,false
53,Full Outage of Trasanction Processing,Service Incident,Closed,P1,"Transaction processing experienced a full outage due to a connectivity problem with the ISP for the London DC, starting at 23:56 UTC on 11 Feb. The connectivity issue was resolved, and normal transaction processing resumed at 00:09 UTC on 12 Feb. ",Vicnesh Baskar,Vicnesh Baskar,,,,Banking.Live,"Mettle, Coverflex, Rain",The issue self-recovered,148 transactions timed-out due to FAST ACTIVE Request and FAST ACTIVE Response failures,Third-Party - Paymentology,,,,,,,,,,,,2025-02-12T00:47:12.486Z,2025-02-12T00:06:00.000Z,,,,,2025-02-12T01:31:19.828Z,2025-02-11T15:56:00.000Z,2025-02-11T23:56:00.000Z,2025-03-12T00:09:00.000Z,,2025-02-12T08:05:42.723Z,2025-02-12T08:05:42.723Z,5119,2025-02-12T08:05:42.826Z,,public,199.1,175,4.1,20,12feb-p1-critical-53-full-outage-of-trasanction-processing,https://slack.com/app_redirect?team=T03SMJWS8&channel=C08CY9XU59S,Reported by Vicnesh Baskar,true
