268,Partial Outage of Transactions Processing,Service Incident,Closed,P3 - Critical,"At 22:20 UTC on October 14, 2025, the support team was alerted to a spike in active connections on a Crimson node, which resulted in temporary transaction timeouts. The alerts auto-resolved shortly after being raised. Upon investigation, a blocking query in the databases was identified as the likely cause of the disruption.

The system has since stabilised, and transaction processing has returned to normal since 22:22 UTC. Heightened monitoring remains in place to ensure continued stability.",Vicnesh Baskar,Vicnesh Baskar,,,,VoucherEngine,"Albo, Ascend Group (True Money), GoTyme, Fondeadora/Mibo, Nelo, Ecocash",Auto resolved,Partial Outage of Transaction Processing,Paymentology,,Transaction Processing,,,,,,,,,https://paymentology.atlassian.net/wiki/spaces/TS/pages/9081913405/2025-10-14+-+P3+-+Critical+-+Partial+Outage+of+Transactions+Processing,2025-10-14T23:36:27.743Z,2025-10-14T23:36:27.743Z,,,,,,,,,2025-10-14T23:39:32.745Z,,2025-10-14T23:39:32.745Z,,2025-10-15T13:46:44.751Z,,public,78.2,61.7,0,16.5,15oct-p3-critical-268-partial-outage-of-transactions-processing,https://slack.com/app_redirect?team=T03SMJWS8&channel=C09LJCUK1H8,Reported by Vicnesh Baskar,true
269,Service disruption on Mastercard File Express,Service Incident,Closed,P3 - Non-Critical,"On 14 October 2025 at 23:10 UTC, Mastercard issued a notification regarding a service disruption on the Mastercard File Express (MFE) platform, indicating customer access issues. This impacted both the Banking.Live (BL) and Voucher Engine (VE) platforms by delaying settlement file delivery and downstream reporting. Transaction processing was unaffected throughout the incident.
On BL, delayed receipt of T140 and T112 settlement files was observed across multiple endpoints. VE experienced similar delays, halting generation of daily settlement reports. All systems remained online and capable of processing files once received.
Following incident declaration, teams initiated impact analysis, monitored file flow, and validated internal readiness to resume processing. Continuous engagement was maintained with Mastercard via MC Connect and Mission Control, with repeated escalations to ensure prioritization of file recovery.
File delivery resumed progressively on 15 October. Once received, all settlement files were validated and processed. Faulty or incomplete files were manually retrieved and reloaded where required. Reporting processes were re-triggered on both platforms to ensure completeness. Duplicate handling logic and audit controls were closely monitored during recovery to prevent downstream inconsistencies.
The incident was formally resolved following Mastercard’s confirmation at 18:17 UTC on 15 October 2025. All delayed files were accounted for and processed successfully, with no residual impact to reporting or settlement systems.",Vicnesh Baskar,Vicnesh Baskar,,,Claudiu Stoica,Banking.Live,,Recovery of Mastercard MFE,Settlement processing and reporting will be delayed for all MC clients,Third-Party - Paymentology,,,,,,,,,,,https://paymentology.atlassian.net/wiki/spaces/TS/pages/9084502038/2025-10-15+-+P3+-+Non-Critical+-+Service+disruption+on+Mastercard+File+Express,2025-10-15T04:28:15.303Z,2025-10-15T04:28:15.303Z,,,,,2025-10-16T03:39:00.449Z,,2025-10-16T03:39:00.449Z,,,,2025-10-16T03:39:00.449Z,83445,2025-10-16T07:44:47.651Z,,public,1733,1326.9,114.7,291.7,15oct-p3-non-critical-269-service-disruption-on-mastercard-file-express,https://slack.com/app_redirect?team=T03SMJWS8&channel=C09LD2NEM6X,Reported by Vicnesh Baskar,false
270,Expired pre-authorisations not reversing after expiry date,Service Incident,Closed,P3 - Non-Critical,"Automated reversals for expired pre-authorisations were not processed for certain campaigns, leaving funds held for cardholders.

Cardholders in affected campaigns had funds held beyond the expected expiry period. The backlog reached over 30,000 missed reversals but has now been cleared, with the reversal queue reduced to 9 and all affected transactions processing.

A recent change required a non-NULL expiry date in the reversal script, which excluded over 30,000 valid expired pre-authorisations from being processed. Additionally, a static configuration list was missing entries, causing false settlement file alerts and blocking some reversals.

VE Team updated the reversal script to handle transactions without expiry dates and deployed a configuration fix for false settlement file alerts. Both fixes have been deployed, resulting in successful processing of all impacted reversals and resolution of false alerts.",Vicnesh Baskar,Vicnesh Baskar,,,Dominic Wee,VoucherEngine,,,,Third-Party - Paymentology,,,,,,,,,,,https://paymentology.atlassian.net/wiki/spaces/TS/pages/9112813592/2025-10-16+-+P3+-+Non-Critical+-+Expired+pre-authorisations+not+reversing+after+expiry+date,2025-10-16T01:36:36.284Z,2025-10-16T01:36:36.284Z,,,,,2025-10-17T07:21:32.053Z,,2025-10-17T07:21:32.053Z,,,,2025-10-17T07:21:32.053Z,107095,2025-10-24T07:29:37.100Z,,public,1779.1,1513.9,191.5,73.6,16oct-p3-non-critical-270-expired-pre-authorisations-not-reversing-after-ex,https://slack.com/app_redirect?team=T03SMJWS8&channel=C09M5QE9AMP,Reported by Vicnesh Baskar,false
271,Partial Outage of Transaction Processing ,Service Incident,Post-Incident Tasks & Documentation,P3 - Critical,"Partial Outage of Transaction Processing was observed on PROD_VISA_3A and PROD_VISA_4B. Service was restored after removing transaction server (TT-AWS-P-TRN-01) from the cluster, restarting it, and adding it back. Since 18:47 UTC, transactions have been processing as expected.",Kaisar Mahmood,Kaisar Mahmood,,,,VoucherEngine,,,,Paymentology,   ________________________________________________________________________________         Microsoft Teams     Need help?            Join the meeting now            Meeting ID:      347 597 653 444            Passcode:      bA7P6Uw7                                                      ________________________________________________________________________________,,,,,,,,,,https://paymentology.atlassian.net/wiki/spaces/TS/pages/9109012484/2025-10-16+-+P3+-+Critical+-+Partial+Outage+of+Transaction+Processing,2025-10-16T18:41:38.433Z,2025-10-16T18:41:38.433Z,,,,,2025-10-16T20:40:45.833Z,2025-10-16T17:00:00.000Z,2025-10-16T20:40:45.833Z,,,,,7147,2025-10-23T08:50:38.174Z,,public,174.8,95.7,79.1,0,16oct-p3-critical-271-partial-outage-of-transaction-processing,https://slack.com/app_redirect?team=T03SMJWS8&channel=C09MT6CEQNL,Reported by Kaisar Mahmood,false
272,Dynamic Block Functionality Failure,Service Incident,Post-Incident Tasks & Documentation,P1,"Following the BL 2.31 release, the dynamic block functionality failed due to a regression in the f_act_BlockCard function. This prevented tokens triggered by fraud rules from being inserted into the t_blocked_entities_toks table. As a result, fraud rules activated correctly, but the corresponding blocking actions were not applied, potentially allowing fraudulent transactions to proceed.

The regression introduced in BL 2.31 altered the f_act_BlockCard function, breaking the token insertion process for dynamic blocking. This issue impacted all environments running BL version 2.31 and above.

The fraud and SD team identified the faulty logic and implemented a hotfix. This fix was tested and deployed to all affected environments, including:

• ISB (194 cases)

• C24 Bank (9,548 cases)

• Union54 (522 cases)

Shared02, although not actively using dynamic blocking, received the hotfix proactively due to client readiness. All other environments were confirmed unaffected.

Post-deployment monitoring is ongoing to ensure the fix is effective and that normal dynamic blocking functionality is restored across all environments.",Snothile Dlamini,Snothile Dlamini,,,,Banking.Live,"Islandsbanki, C24, Union54 / Zazu Zambia",,,Paymentology,,,,,,,,,,,https://paymentology.atlassian.net/wiki/spaces/TS/pages/9089450158/2025-10-17+-+P1+-+Dynamic+Block+Functionality+Failure,2025-10-17T12:47:52.716Z,2025-10-17T12:47:52.716Z,,,,,2025-10-17T15:31:24.636Z,2025-10-14T01:20:00.000Z,2025-10-17T12:49:44.398Z,2025-10-17T13:44:11.782Z,,,,9811,2025-10-17T15:32:17.275Z,,public,796.2,766.2,30,0,17oct-p1-272-dynamic-block-functionality-failure,https://slack.com/app_redirect?team=T03SMJWS8&channel=C09M21G343Y,Reported by Snothile Dlamini,false
273,Partial Outage of Transaction Processing ,Service Incident,Closed,P3 - Critical,"All MOX settlements have processed successfully, with confirmation from both log analytics and database monitoring. No high database load or errors were observed during processing, though there were brief CPU and disk latency spikes that did not impact successful completion.
Client MOX has been updated via the [Zendesk ticket](https://paymentology.zendesk.com/agent/tickets/1044828 ""Zendesk ticket"").",Kaisar Mahmood,Kaisar Mahmood,,,,Banking.Live,MOX,,72 advisements from Mastercard with 7598 successfully processed Mastercard transaction from 00:53 - 1:36 AM – 20th Oct 2025,Paymentology,,,,,,,,,,,https://paymentology.atlassian.net/wiki/spaces/TS/pages/9107406920/2025-10-20+-+P3+-+Critical+-+Partial+Outage+of+Transaction+Processing,2025-10-20T02:49:41.500Z,2025-10-20T02:49:41.500Z,,,,,2025-10-23T07:29:16.890Z,2025-10-19T23:49:00.000Z,2025-10-23T07:29:16.890Z,,2025-10-23T07:30:18.000Z,,2025-10-23T07:30:18.000Z,275975,2026-02-02T10:09:15.350Z,,public,1858,1420.9,204.8,232.1,20oct-p3-critical-273-partial-outage-of-transaction-processing,https://slack.com/app_redirect?team=T03SMJWS8&channel=C09M7AJ6VEX,Reported by Kaisar Mahmood,true
274,Full Outage of Transaction Processing,Service Incident,Post-Incident Tasks & Documentation,P1,"**Issue**: Transaction processing was completely unavailable for all clients listed below on the Banking.Live platform.

**Impact**: Clients were unable to process transactions from 05:00 to 05:28 UTC.
We received advice messages after 05:28 as they belonged to the transactions that were attempted before the rollback.
All transactions after 05:28 were processed as expected.

**Causes**: A deployment related to CCM-1618 went over the risk time, causing transaction processing to fail across all clients.

**Steps to resolve**: We rolled back the CCM-1618 deployment at 05:28 UTC, which restored transaction processing for all clients. All services are now fully operational.",Daniel Velado,Daniel Velado,,,,Banking.Live,,,,Paymentology,,,,,,,,,,,https://paymentology.atlassian.net/wiki/spaces/TS/pages/9098788868/2025-10-21+-+P1+-+Full+Outage+of+Transaction+Processing,2025-10-21T05:26:56.914Z,2025-10-21T05:26:56.914Z,,,,,2025-10-21T06:03:41.926Z,,2025-10-21T06:03:41.926Z,,,,,2205,2026-02-02T17:05:03.699Z,,public,963.8,710.6,88.7,164.5,21oct-p1-274-full-outage-of-transaction-processing,https://slack.com/app_redirect?team=T03SMJWS8&channel=C09N0H2HEKB,Reported by Daniel Velado,false
275,TEST INCIDENT - PLEASE IGNORE - IGNORE,Service Incident,Closed,P4,IGNORE IGNORE IGNORE,Stephen Fleming,Stephen Fleming,,,,Banking.Live,,Test incident - closing,,,,,,,,,,,,,,2025-10-22T08:15:32.758Z,2025-10-22T08:15:32.758Z,,,,,2025-10-23T20:17:33.933Z,2025-10-22T08:15:00.000Z,2025-10-23T20:17:33.933Z,,,,2025-10-23T20:17:33.933Z,129721,2025-10-23T20:17:34.114Z,,public,58.3,48.3,10,0,22oct-p4-275-test-incident-please-ignore-ignore,https://slack.com/app_redirect?team=T03SMJWS8&channel=C09MQ0W8QSF,Reported by Stephen Fleming,false
276,Partial Outage of Transaction Processing,Service Incident,Post-Incident Tasks & Documentation,P3 - Critical,"B.L. client BAE experienced a problem with Rule Engine between 18:13:18 and 18:17:41.
Declines - none
Approvals - 522
Advices - 77
Impact 12.85%",Daniel Velado,Daniel Velado,,,,Banking.Live,Bank of Jordan,,,Paymentology,,,,,,,,,,,https://paymentology.atlassian.net/wiki/spaces/TS/pages/9110978580/2025-10-23+-+P3+-+Critical+-+Partial+Outage+of+Transaction+Processing,2025-10-23T19:25:58.928Z,2025-10-23T19:25:58.928Z,,,,,,,,,,,,,2026-02-02T17:05:52.676Z,,public,173.5,172.7,0.8,0,23oct-p3-critical-276-partial-outage-of-transaction-processing,https://slack.com/app_redirect?team=T03SMJWS8&channel=C09P4CJRVGQ,Reported by Daniel Velado,false
277,Visa Certificate Renewal Issue  ,Service Incident,Closed,P4,"The Visa offline settlement certificate renewal has been completed successfully. There was no disruption to clearing, settlement, or refunds, and all client communications have been sent to confirm continued service stability. Settlement processing over the weekend was completed without any issues. Process improvements are underway, including the creation of a consolidated certificate register.",Kaisar Mahmood,Kaisar Mahmood,,,,Banking.Live,,certificate renewal has been completed successfully,"Potential impact to end-of-day clearing, settlement, or refunds for a period until the certificate is renewed",Paymentology,,,,,,,,,,,,2025-10-24T10:29:30.686Z,2025-10-24T10:29:30.686Z,,,,,2025-10-27T09:49:07.523Z,2025-10-23T23:00:00.000Z,2025-10-27T09:49:07.523Z,,,,2025-10-27T09:49:07.523Z,256776,2025-10-27T09:49:07.742Z,,public,518.1,485.9,32.2,0,24oct-p4-277-visa-certificate-renewal-issue,https://slack.com/app_redirect?team=T03SMJWS8&channel=C09P8QHLDR6,Reported by Kaisar Mahmood,false
278,Partial Outage of Transaction Processing,Service Incident,Post-Incident Tasks & Documentation,P1,"At 11:03 UTC, connectivity between ACS and the host at 196.37.41.81:50045 was interrupted due to a network outage with NTT. This caused intermittent authorization declines for BINs 526722 and 533822.

The issue was initially reported through customer support calls and later confirmed by ACS, who saw connectivity beginning to restore by 11:14 UTC and fully restoring by 11:22 UTC.

After the connection was re-established, transaction approvals returned to normal with no ongoing impact. The root cause has been traced to the upstream outage from the NTT carrier. Further investigation into the root cause will be provided in the RCAR. ",Snothile Dlamini,Snothile Dlamini,,,,VoucherEngine,,,,Third-Party - Paymentology,,,,,,,,,,,https://paymentology.atlassian.net/wiki/spaces/TS/pages/9115238401/2025-10-24+-+P1+-+Transaction+Processing+Outage,2025-10-24T12:17:59.969Z,2025-10-24T12:17:59.969Z,,,,,2025-10-24T09:23:00.000Z,2025-10-24T09:03:00.000Z,,,,,,,2026-02-02T17:06:24.316Z,,public,197.9,192.1,5.8,0,24oct-p1-278-partial-outage-of-transaction-processing,https://slack.com/app_redirect?team=T03SMJWS8&channel=C09NF4CU4RG,Reported by Snothile Dlamini,false
280,Full Outage of Transaction and API Processing,Service Incident,Post-Incident Tasks & Documentation,P1,"At 20:43 UTC on October 26, Paymentology's monitoring reported a disruption affecting transaction processing for WIO Bank. The root cause was a connectivity problem between PayRoute and the UAE switch due to an Azure tunnel disruption. Even though the tunnel later appeared connected, data wasn’t flowing back, which blocked authorizations and API calls from completing.

The system stayed on a backup network route, but an automatic switch back to the primary route didn’t happen as it should have. At 22:37 UTC, normal transaction processing and API operations resumed after WIO manually reset the tunnel from their end. Monitoring confirmed that transactions with Visa, Mastercard, and the UAE switch were back to normal and stable.

The incident was triggered by a partial tunnel failover and a delayed reconnection at the application level. Logs are now being gathered to analyze the event further. Next steps include updating recovery procedures and reviewing Azure tunnel settings with the client to prevent similar issues.",Snothile Dlamini,Snothile Dlamini,,,,Banking.Live,Wio,,Transaction and API Processing ,Third-Party - Paymentology,,,,,,,,,,,https://paymentology.atlassian.net/wiki/spaces/TS/pages/9120153606/2025-10-26+-+P1+-+Transaction+Processing+Outage,2025-10-26T22:16:21.610Z,2025-10-26T22:16:21.610Z,,,,,2025-10-26T22:54:35.612Z,,2025-10-26T22:54:35.612Z,,,,,2294,2026-02-02T17:06:44.921Z,,public,385.2,271.3,10.3,103.6,26oct-p1-280-full-outage-of-transaction-and-api-processing,https://slack.com/app_redirect?team=T03SMJWS8&channel=C09NVT14XJ8,Reported by Snothile Dlamini,false
281,ATM Non-Disbursement Outage,Service Incident,Post-Incident Tasks & Documentation,P3 - Critical,"Mukuru reported that multiple cardholders are attempting ATM withdrawals, but funds are not being disbursed despite transactions showing as pending on the Voucher Engine (VE). The escalation originated from child ticket #1050966. Early indications suggest that transactions appear successful on VE, similar to a previous behavior observed in earlier incidents.",Snothile Dlamini,Snothile Dlamini,,,,VoucherEngine,Mukuru,,,Third-Party - Paymentology,,,,,,,,,,,https://paymentology.atlassian.net/wiki/spaces/TS/pages/9156853792/2025-10-27+-+P3+-+Critical+-+ATM+Non-Disbursement+Outage,2025-10-27T08:20:49.706Z,2025-10-27T08:20:49.706Z,,,,,2025-10-31T17:20:07.676Z,,2025-10-31T17:01:59.046Z,,,,,376869,2026-02-02T10:11:03.528Z,,public,1988.8,1811.7,124.6,52.5,27oct-p3-critical-281-atm-non-disbursement-outage,https://slack.com/app_redirect?team=T03SMJWS8&channel=C09NNAW1DC3,Reported by Snothile Dlamini,false
282,Partial Outage of Transaction Processing,Service Incident,Post-Incident Tasks & Documentation,P3 - Non-Critical,"On 28 October 2025 at 04:04 UTC, Monitoring team was alerted to intermittent disconnections affecting transaction processing with both VISA and Mastercard schemes. These disruptions caused a partial outage impacting authorisations.

The VISA PayRoute disconnection was traced to a BL 3.0 deployment on SHARED02, resulting in failed connections to PKS endpoints (10.22.2.25 and 10.22.2.26). Mastercard disconnections occurred separately and are still under investigation, with a support ticket raised with Mastercard for root cause analysis.

Transaction processing normalised by 04:26 UTC after automatic reconnections were established. Several shared and dedicated clients experienced an impact on multiple windows during this period. A detailed impact assessment is ongoing.",Vicnesh Baskar,Vicnesh Baskar,Rahadian Pratama,,Dominic Wee,Banking.Live,,,Partial Outage of Transaction Processing,Paymentology,,,,,,,,,,,https://paymentology.atlassian.net/wiki/spaces/TS/pages/9128443907/2025-10-28+-+P1+-+Partial+Outage+of+Transaction+Processing,2025-10-28T04:38:04.738Z,2025-10-28T04:38:04.738Z,,,,,2025-10-28T05:43:21.359Z,,2025-10-28T05:43:21.359Z,,,,,3916,2025-10-28T14:38:57.971Z,,public,715.2,672.9,32.4,10,28oct-p3-non-critical-282-partial-outage-of-transaction-processing,https://slack.com/app_redirect?team=T03SMJWS8&channel=C09PFAJVCKB,Reported by Vicnesh Baskar,false
283,MC settlement files not processed,Service Incident,Closed,P3 - Non-Critical,"MC settlement files for a client were not processed from October 27, 2025, onwards due to a change in the MFE file download directory. Files were being placed in the MFE root directory instead of the expected subdirectory. No FAST settlement messages were generated during this period, impacting downstream reconciliation processes.

The client has now acknowledged that

1. Backdated file processing (27–29 Oct 2025) can proceed. 

2. All impacted settlement records will be consolidated into a single presentment report. 

3. Upon processing, delayed FAST settlement messages will be generated and sent.

 The download paths for the T112 and T114 files have been updated in the MFE configuration to point to the correct subdirectories.

Service delivery has confirmed no unexpected access to the MFE server during the impacted period, and directory changes are now aligned with PS Task requirements. The client previously confirmed that most pending authorizations have been cleared once settlement records were sent.",Vicnesh Baskar,Vicnesh Baskar,,,Dominic Wee,Banking.Live,Xendit,,,,,,,,,,,,,,https://paymentology.atlassian.net/wiki/spaces/TS/pages/9166389254/2025-10-29+-+P3+-+Non-Critical+-+MC+settlement+files+not+processed,2025-10-29T03:46:36.482Z,2025-10-29T03:46:36.482Z,,,,,2025-10-29T10:21:57.966Z,,2025-10-29T05:13:16.756Z,,,,2025-10-29T10:21:57.966Z,12920,2025-11-04T07:26:49.792Z,,public,1470.5,1115.8,161.6,193.2,29oct-p3-non-critical-283-mc-settlement-files-not-processed,https://slack.com/app_redirect?team=T03SMJWS8&channel=C09P4UGD2BV,Reported by Vicnesh Baskar,false
284,Partial Outage of 3DS transactions,Service Incident,Closed,P3 - Critical,"On 22 October 2025 at 21:00 UTC, the technical teams completed a scheduled migration of a client to the Mastercard production environment using Bankserv’s ACS for 3D Secure (3DS) authentication. Initial testing confirmed successful 3DS flows.
However, by 26 October, the client reported a high rate of failed 3DS transactions. Investigation revealed a significant spike in Action Code 1022 errors, caused by IAV (Integrity Authentication Value) validation failures. The root cause was traced to a different ACS key being used in the Bankserv environment post-migration.
The key was corrected during a joint troubleshooting session with Bankserv on 29 October 2025, and the final 3DS failure with error 1022 occurred at 08:31 UTC. Close monitoring remains in place, and a detailed RCA and future corrective actions will follow in the RCAR.",Vicnesh Baskar,Vicnesh Baskar,,,Wafa Ben Nacef,VoucherEngine,Ecocash,,Partial Outage of 3DS transactions,Third-Party - Paymentology,https://teams.microsoft.com/l/meetup-join/19%3ameeting_YTgwNWU5ODItOTRmZi00MDIzLTg3MTgtODQzZjc5NjI1MGYz%40thread.v2/0?context=%7b%22Tid%22%3a%224f7797e2-a59f-4381-ad8e-b81223603c9d%22%2c%22Oid%22%3a%225bc8ffce-74fa-4e51-af76-275e9877517e%22%7d,,,,,,,,,,https://paymentology.atlassian.net/wiki/spaces/TS/pages/9134637125/2025-10-29+-+P3+-+Critical+-+Partial+Outage+of+3DS+transactions,2025-10-29T07:48:47.126Z,2025-10-29T07:48:47.126Z,,,,,2025-10-29T09:13:41.234Z,,2025-10-29T09:13:41.234Z,,2025-10-29T09:36:04.400Z,,2025-10-29T09:36:04.400Z,5094,2025-10-29T09:39:03.346Z,,public,373.3,363.3,0,10,29oct-p3-critical-284-partial-outage-of-3ds-transactions,https://slack.com/app_redirect?team=T03SMJWS8&channel=C09PADCQ4CE,Reported by Vicnesh Baskar,true
285,RTC - Transaction Processing Outage ,Service Incident,Post-Incident Tasks & Documentation,P3 - Critical,"RTC transaction processing experienced a partial outage beginning at 20:30 UTC on 28 October 2025. The issue affected RTC transactions only; ATM and POS transactions continued to process normally.

We identified that connectivity was failing for the MIP environment connected via Vodacom MPLS, while the Teraco Fiberlink environment remained accessible. The networking issue was traced to a source IP configuration change on Access Bank’s side. After corrective action from Access Bank's networking team, connectivity was restored to both MIP instances.

RTC processing is now fully operational over the MPLS link. Access Bank will conduct an internal investigation and provide a root cause analysis. A detailed impact assessment will follow.",Snothile Dlamini,Snothile Dlamini,,,Tshegofatso Manakana,Acorn / FlexPay,,,,Third-Party - Paymentology,,,,,,,,,,,https://paymentology.atlassian.net/wiki/spaces/TS/pages/9134866517/2025-10-29+-+P2+-+RTC+-+Transaction+Processing+Outage,2025-10-29T08:03:51.676Z,2025-10-29T08:03:51.676Z,,,,,2025-10-29T08:31:04.152Z,,2025-10-29T08:31:04.152Z,,,,,1632,2025-10-30T07:31:02.986Z,,public,121.6,121.6,0,0,29oct-p3-critical-285-rtc-transaction-processing-outage,https://slack.com/app_redirect?team=T03SMJWS8&channel=C09P65R2SAX,Reported by Snothile Dlamini,false
286,OCI VPN Connectivity Failure,Service Incident,Post-Incident Tasks & Documentation,P1,"At 07:29 UTC, Paymentology identified a partial outage caused by a connectivity problem within OCI’s Saudi region. This issue led to a loss of VPN access, which temporarily affected the visibility and authorization of transactions for clients Derayah and Tweeq. Fortunately, Derayah’s MADA transactions continued without interruption. However, Tweeq’s Mastercard transactions experienced a brief disruption.

By approximately 08:17 UTC, OCI had restored connectivity, and all systems, including Visa and Mastercard processing, quickly returned to normal. The database and service delivery teams confirmed that full recovery and data integrity were maintained. The incident has now been resolved, and ongoing monitoring shows stable operations across all environments. OCI’s confirmatory root cause analysis is still pending and will be included in the final RCA report.",Snothile Dlamini,Snothile Dlamini,,,,Banking.Live,"D360, Tweeq",,,Third-Party - Paymentology,,,,,,,,,"D360, TWEEQ",,https://paymentology.atlassian.net/wiki/spaces/TS/pages/9141583897/2025-10-30+-+P1+-+OCI+VPN+Connectivity+Failure,2025-10-30T07:55:25.936Z,2025-10-30T07:55:25.936Z,,,,,2025-10-30T08:47:08.377Z,,2025-10-30T08:47:08.377Z,,,,,3102,2025-10-30T08:47:26.892Z,,public,505.4,505.4,0,0,30oct-p1-286-oci-vpn-connectivity-failure,https://slack.com/app_redirect?team=T03SMJWS8&channel=C09PKH5H6T0,Reported by Snothile Dlamini,false
