137,Full Outage of Transaction Processing - D360,Service Incident,Root Cause Analysis and Corrective Actions,P1,"Full Outage of transaction processing occurred from 10:43 -10:57 UTC on 3rd May. Currently transactions are processing as expected with no issues. Investigation into the technical root cause is on-going, thus far no issues identified within PYTG application/infra.",Kaisar Mahmood,Kaisar Mahmood,,,,Banking.Live,D360,"Auto resolved, no action was taken by PYTG support teams.",Full Outage of transaction processing occurred from 10:43 -10:57 UTC on 3rd May - (Transactions were processed in STIP),Paymentology,,,,,,,,,,,https://paymentology.atlassian.net/wiki/spaces/TS/pages/8703934833/Incident+Post+Mortem+INC-137+2025-05-03+-+P1+-+Full+Outage+of+Transaction+Processing+-+D360,2025-05-03T13:03:55.323Z,2025-05-03T13:03:55.323Z,,,,,2025-05-05T07:06:15.616Z,2025-05-03T02:43:00.000Z,2025-05-03T13:16:31.420Z,,2025-05-05T07:07:50.382Z,,,756,2026-02-02T15:14:41.879Z,,public,268.8,168.3,78.9,21.6,03may-p1-137-full-outage-of-transaction-processing-d360,https://slack.com/app_redirect?team=T03SMJWS8&channel=C08R4N0QSLR,Reported by Kaisar Mahmood,false
138,Partial Outage of Transaction Processing,Service Incident,Closed,P1,"On 08 May 2025 at 05:02 UTC, the Support team was alerted about a partial outage impacting transaction processing in SH02. Initial investigation showed that tokenised FAST transactions were failing with HTTP 400 errors after a deployment, causing transactions to be routed to STIP. The issue was identified as a JSON formatting error in the FAST request specific to the deployment. A hotfix was prepared and deployed across all PayPowers, with deployment completed by 07:35 UTC. Transaction processing normalised after 07:48 UTC with no further failures observed. The issue was resolved by fixing the JSON formatting and deploying the corrected version. Internal technical teams have been engaged for a detailed investigation. Further updates on the root cause and preventive actions will be provided in the RCA Report (RCAR).",Vicnesh Baskar,Vicnesh Baskar,,,Abdul Sahaptheen,Banking.Live,Constantinople,,Tokenized transactions are being processed in Standin,Paymentology,,,,,,,,,,,https://paymentology.atlassian.net/wiki/spaces/TS/pages/8715042847/2025-05-08+-+P1+-+Partial+Outage+of+Transaction+Processing,2025-05-08T06:52:07.825Z,2025-05-08T06:52:07.825Z,,,,,2025-05-08T08:03:52.662Z,,2025-05-08T07:36:49.493Z,2025-05-08T08:03:52.662Z,2025-05-09T06:37:29.121Z,2025-05-13T22:50:02.303Z,2025-05-13T22:50:02.303Z,4304,2026-02-02T15:15:05.318Z,,public,423.6,374.2,0,49.4,08may-p1-138-partial-outage-of-transaction-processing,https://slack.com/app_redirect?team=T03SMJWS8&channel=C08R7UHP3JA,Reported by Vicnesh Baskar,false
139,Intermittent Transaction Processing Outage,Service Incident,Closed,P4,AS and Auth team checked the corresponding message on payroute logs for the few impacted auth from paypower and have concluded that there is no impact. It was a logging issue on the Paypower side but the correct message is sent to the Payroute and eventually UAEswitch. ,Snothile Dlamini,Snothile Dlamini,,,Kamal Thapa,Banking.Live,Wio,N/A,,,https://teams.microsoft.com/l/meetup-join/19%3ameeting_MzRiMzJmZGEtMWEwZC00YjQyLWI0ODA%5B%E2%80%A6%5D2c%22Oid%22%3a%22067d56db-044f-4b5b-b44c-8303c87625ab%22%7d,,,,,,,,,,,2025-05-09T12:12:02.151Z,2025-05-09T12:12:02.151Z,,,,,2025-05-09T13:13:17.549Z,,2025-05-09T13:13:17.549Z,,2025-05-09T13:13:29.548Z,,2025-05-09T13:13:29.548Z,3675,2025-05-09T13:17:18.775Z,,public,369.8,334.8,35.1,0,09may-p4-139-intermittent-transaction-processing-outage,https://slack.com/app_redirect?team=T03SMJWS8&channel=C08SAAS9KT2,Reported by Snothile Dlamini,true
140,Full Outage of Transaction Processing,Service Incident,Post-Incident Tasks & Documentation,P1,"**Issue:** There was a full outage of transaction processing for BOJ starting from 13-May-2025 17:02:15.483.

**Impact:** There was a complete interruption of transaction processing for clients.

**Causes:** The outage was related to a routing issue between BOJ and Azure

**Steps to resolve:** Transactions resumed by 13-May-2025 18:20:51.570, following a conference call with BOJ's infrastructure team to troubleshoot and ensure connections were restored.",Daniel Velado,Daniel Velado,,,,Banking.Live,Bank of Jordan,,,Third-Party - Paymentology,,,,,,,,,,,https://paymentology.atlassian.net/wiki/spaces/TS/pages/8745910392/2025-05-13+-+P1+-+Full+Outage+of+Transaction+Processing,2025-05-13T17:41:29.068Z,2025-05-13T17:41:29.068Z,,,,,2025-05-13T18:36:14.364Z,,2025-05-13T18:22:32.339Z,2025-05-13T18:36:14.364Z,,,,3285,2026-02-02T15:17:03.980Z,,public,441.4,391.3,50.1,0,13may-p1-140-full-outage-of-transaction-processing,https://slack.com/app_redirect?team=T03SMJWS8&channel=C08SV6HU4BS,Reported by Daniel Velado,false
141,D360 - Missing VISAIN files for 13 May,Service Incident,Closed,P4,"VISAIN files for 13 May were initially reported as missing which could affect settlements.

An early trigger of the ProcessSettlementVISA likely caused the alert due to a D360 deployment PS restart.

The incident was downgraded to a P4 as there was no impact, and confirmation was received that the necessary settlement report had been generated and sent.",Vicnesh Baskar,Dominic Wee,,,Dominic Wee,Banking.Live,,,,,,,,,,,,,,,,2025-05-14T00:01:56.283Z,2025-05-14T00:01:56.283Z,,,,,2025-05-14T00:47:23.512Z,,2025-05-14T00:47:23.512Z,,,,2025-05-14T00:47:23.512Z,2727,2025-05-14T00:47:47.237Z,,public,121.1,121.1,0,0,14may-p4-141-d360-missing-visain-files-for-13-may,https://slack.com/app_redirect?team=T03SMJWS8&channel=C08S2RRNTR9,Reported by Dominic Wee,false
142,Partial Outage of Transaction Monitoring Capability,Service Incident,Closed,P3 - Non-Critical,"On 14 May 2025 at 04:19 UTC, the Engineering team was alerted about a potential full outage in transaction processing due to multiple Crimson instances (crimson3–8) showing down alerts in monitoring tools. Initial investigation showed that transaction processing appeared halted, and alerts were triggered by missing data in monitoring systems. Further analysis revealed that a timezone discrepancy in the database servers had shifted system timestamps by two hours into the future, causing monitoring tools (DataDog/SumoLogic) to misinterpret data availability.
The database timezone was found to have changed from SAST to UTC, affecting system timestamps. The database host was time-synced and confirmed by 06:45 UTC. Monitoring systems began reflecting correct data, confirming that transaction processing had been running correctly throughout the incident. The issue was resolved by syncing server times and validating system stability.
The Database, Infrastructure, and Application Support were engaged in a detailed investigation. Further updates on the root cause and preventive actions will be provided in the RCA Report (RCAR).",Vicnesh Baskar,Vicnesh Baskar,,,Ardiansyah Ar,VoucherEngine,"Agoda, Phillip Bank, Vodafone Fiji, Melkar",,Crimson nodes are down impacting transaction processing,Paymentology,https://teams.microsoft.com/l/meetup-join/19%3ameeting_YjliMTI5M2MtY2Y1ZC00Yzc2LWJhOWEtOWRiOTg1ODdkZDVj%40thread.v2/0?context=%7b%22Tid%22%3a%224f7797e2-a59f-4381-ad8e-b81223603c9d%22%2c%22Oid%22%3a%225bc8ffce-74fa-4e51-af76-275e9877517e%22%7d,Transaction Processing,,,,,,,,,,2025-05-14T04:52:09.933Z,2025-05-14T04:52:09.933Z,,,,,2025-05-14T08:28:51.152Z,,2025-05-14T08:28:51.152Z,,2025-07-15T06:54:53.615Z,,2025-07-15T06:54:53.615Z,13001,2025-07-15T06:54:53.717Z,,public,1180.6,1056.4,53.8,70.4,14may-p3-non-critical-142-partial-outage-of-transaction-monitoring-capabili,https://slack.com/app_redirect?team=T03SMJWS8&channel=C08SXQK6YLQ,Reported by Vicnesh Baskar,true
143,Partial Outage of ATM Transaction Processing - Flexpay,Service Incident,Post-Incident Tasks & Documentation,P1,"On May 17th at 09:00 UTC, we received cardholder reports regarding ATM transactions not working.

Our Dev team noticed reduced traffic for Acorn/Flexpay ATM transactions.
Application and network checks were performed, not returning any error from PYTG side.

Mastercard confirmed an infrastructure problem on their side, which prevented ATM transactions from all acquirers but one from going through.

Additional root cause information and preventive measures have been requested from Mastercard.",Daniel Velado,Daniel Velado,,,,Acorn / FlexPay,,,,Third-Party - Client,https://teams.microsoft.com/l/meetup-join/19%3ameeting_MjRjMGM2MmEtZTkwZS00NWRmLWI0NGQtYmUwOTUyYjYyMzQz%40thread.v2/0?context=%7b%22Tid%22%3a%224f7797e2-a59f-4381-ad8e-b81223603c9d%22%2c%22Oid%22%3a%2277fd2081-e5b3-4187-a436-a13e4cc70a0f%22%7d,,,,,,,,,,https://paymentology.atlassian.net/wiki/spaces/TS/pages/8745844980/2025-05-17+-+P1+-+Partial+Outage+of+ATM+Transaction+Processing+-+Flexpay,2025-05-17T09:56:24.723Z,2025-05-17T09:56:24.723Z,,,,,2025-05-17T16:30:49.916Z,,2025-05-17T16:30:49.916Z,,,,,23665,2026-02-02T15:17:30.285Z,,public,476.5,307.1,34.8,134.6,17may-p1-143-partial-outage-of-atm-transaction-processing-flexpay,https://slack.com/app_redirect?team=T03SMJWS8&channel=C08T7CJ8XG9,Reported by Daniel Velado,false
144,Full Outage of Transaction Processing,Service Incident,Root Cause Analysis and Corrective Actions,P1,"On 19 May 2025 at 03:42 UTC, Advanced Support team was alerted by a client about issues with transaction processing and API failures, including `sc_get_cvv2`, `sc_get_pan`, and `v2_sc_get_pin`. Initial investigation indicated the problem was due to the expiry of a PKS certificate, which affected transaction processing.
The PKS system's certificate validity was extended to the year 2030, and both PKS 01 and PKS 02 instances were restarted. By 04:34 UTC, successful API and transaction processing were confirmed, and normal service was restored. Further updates on the root cause and preventive actions will be provided in the RCA Report (RCAR).",Vicnesh Baskar,Vicnesh Baskar,,,Dominic Wee,Banking.Live,Zing,The issue was resolved by updating the certificate and restarting the affected components,,Paymentology,,,,,,,,,,,https://paymentology.atlassian.net/wiki/spaces/TS/pages/8740929585/2025-05-19+-+P1+-+Full+Outage+of+Transaction+Processing+1,2025-05-19T04:18:32.704Z,2025-05-19T04:18:32.704Z,,,,,2025-05-19T04:51:18.579Z,,2025-05-19T04:51:18.579Z,,2025-05-20T09:02:00.247Z,,,1965,2025-05-20T09:02:00.581Z,,public,342.9,278.6,20,44.3,19may-p1-144-full-outage-of-transaction-processing,https://slack.com/app_redirect?team=T03SMJWS8&channel=C08SPBARLLT,Reported by Vicnesh Baskar,false
145,Partial Outage of Trasaction Processing ,Service Incident,Post-Incident Tasks & Documentation,P1,"Currently investigating a high spike on 9120 for BIN 533892.

Error ratio: 33.36%",Daniel Velado,Daniel Velado,,,,VoucherEngine,Mukuru,,,Paymentology,https://teams.microsoft.com/l/meetup-join/19%3ameeting_NmUzMDBmY2UtMDA0MS00MzM2LTgwMTEtYzcxZWM0NWYzNjVm%40thread.v2/0?context=%7b%22Tid%22%3a%224f7797e2-a59f-4381-ad8e-b81223603c9d%22%2c%22Oid%22%3a%2277fd2081-e5b3-4187-a436-a13e4cc70a0f%22%7d,,,,,,,,,,,2025-05-19T17:04:04.646Z,2025-05-19T17:04:04.646Z,,,,,2025-05-19T17:44:10.818Z,,2025-05-19T17:44:10.818Z,,,,,2406,2026-02-02T15:19:49.887Z,,public,160.3,145.8,14.5,0,19may-p1-145-partial-outage-of-trasaction-processing,https://slack.com/app_redirect?team=T03SMJWS8&channel=C08ST490FH9,Reported by Daniel Velado,false
146,Full Outage of Transaction Processing,Service Incident,Post-Incident Tasks & Documentation,P1,"On 19 May 2025 at 21:17 UTC, the Paymentology team was alerted about a full outage of transaction processing due to a VPN tunnel disruption affecting connectivity with a client. Initial investigation indicated that the tunnel failed to reconnect after a disconnection, potentially due to an upstream ISP issue. Both Paymentology’s and the client’s network teams, along with their respective ISPs and Pulsant, were engaged to investigate the failure.
Prior to the incident, work had already been initiated to reroute traffic via an alternative Azure VPN tunnel. As both ISPs were unable to identify any fault within their networks, it was jointly decided during the incident to proceed with configuring the Azure VPN migration. However, while this migration was underway, the VPN connectivity on the original tunnel self-restored. Upon this restoration, the client opted to roll back any changes related to the Azure VPN and maintain the existing configuration. The Azure VPN migration will instead be completed under a planned change to ensure service stability.
Transaction processing resumed to normal following the restoration of connectivity at 01:25 UTC on 20 May 2025. Both internal and external teams were actively involved throughout the incident, and a detailed root cause analysis and follow-up actions will be documented in the RCAR.",Vicnesh Baskar,Daniel Velado,,,Jenifer Cachero,Banking.Live,Islandsbanki,Self Normalized,,Third-Party - Paymentology,https://teams.microsoft.com/l/meetup-join/19%3ameeting_ZmE2MWFlZjItMDU0OC00MDA0LWJlNDktOTE0NzZlNWIzNmY5%40thread.v2/0?context=%7b%22Tid%22%3a%224f7797e2-a59f-4381-ad8e-b81223603c9d%22%2c%22Oid%22%3a%2277fd2081-e5b3-4187-a436-a13e4cc70a0f%22%7d,,,,,,,,,,https://paymentology.atlassian.net/wiki/spaces/TS/pages/8740864049/2025-05-19+-+P1+-+Full+Outage+of+Transaction+Processing,2025-05-19T22:18:23.938Z,2025-05-19T22:18:23.938Z,,,,,2025-05-20T02:00:35.399Z,,2025-05-20T00:56:26.844Z,2025-05-20T02:00:35.399Z,,,,13331,2026-02-02T15:20:58.298Z,,public,566.2,494.3,0,71.9,19may-p1-146-full-outage-of-transaction-processing,https://slack.com/app_redirect?team=T03SMJWS8&channel=C08SWDL94KG,Reported by Daniel Velado,false
147,Partial Outage of Transaction Processing,Service Incident,Root Cause Analysis and Corrective Actions,P3 - Critical,"On 19 May 2025 at 22:39 UTC, the Advanced Support team was alerted to transaction timeouts from Mastercard. Initial investigation showed a delay in request processing between the PayRoute (PR) and PayKeyService (PKS) systems. The delay is suspected to be caused by a failover event triggered by Azure Maintenance around the same time.
Although the failover completed in a few seconds, subsequent analysis revealed that the PKS (located in the data centre) experienced delays receiving requests from PR for several transactions. This led to transaction timeouts and advisements being triggered.
Transaction processing normalised by 01:23 UTC with no further timeouts. The issue was resolved after the impact window passed and normal communication between PR and PKS resumed.
Internal infrastructure and engineering teams have been engaged to further investigate the communication delay between PR and PKS. Further updates on the root cause and preventive actions will be provided in the RCA Report (RCAR).",Vicnesh Baskar,Vicnesh Baskar,,,,Banking.Live,MOX,Issue self normalized,Intermittern transaction timeouts,Third-Party - Paymentology,,,,,,,,,,,https://paymentology.atlassian.net/wiki/spaces/TS/pages/8740601861/2025-05-20+-+P3+-+Critical+-+Partial+Outage+of+Transaction+Processing,2025-05-20T05:49:41.349Z,2025-05-20T05:49:41.349Z,,,,,2025-05-20T05:50:25.313Z,2025-05-19T14:39:00.000Z,2025-05-20T05:50:25.313Z,,2025-05-20T06:32:41.456Z,,,43,2026-02-02T15:21:33.234Z,,public,430.8,327.8,31.6,71.4,20may-p3-critical-147-partial-outage-of-transaction-processing,https://slack.com/app_redirect?team=T03SMJWS8&channel=C08TH2X6WEM,Reported by Vicnesh Baskar,false
148,Partial Outage of Transaction Processing,Service Incident,Post-Incident Tasks & Documentation,P1,"On May 19th, PYTG Monitoring team received an alert regarding application latency.


Advanced Support and the Database team confirmed an issue on the database side, partially affecting transaction processing, and declining those with error code 9111.
A database high-resource-consumption task was stopped, resulting in transactions to processed again. 

An additional occurrence of this same behaviour was spotted and addressed on May 20th as well

Occurrences:
Start: 2025-05-19 15:13 - End: 2025-05-19 15:20 UTC
Start: 2025-05-20 18:30 - End: 2025-05-20 18:42 UTC 


",Daniel Velado,Daniel Velado,,,,VoucherEngine,,,,Paymentology,,,,,,,,,,,https://paymentology.atlassian.net/wiki/spaces/TS/pages/8745877786/2025-05-20+-+P2+-+Partial+Outage+of+Transaction+Processing,2025-05-20T22:19:17.505Z,2025-05-20T22:19:17.505Z,,,,,,,,,,,,,2026-02-02T15:23:27.958Z,,public,400.6,270.7,32,97.7,20may-p1-148-partial-outage-of-transaction-processing,https://slack.com/app_redirect?team=T03SMJWS8&channel=C08TYSRG5LY,Reported by Daniel Velado,false
149,Partial Outage of Transaction Processing,Service Incident,Post-Incident Tasks & Documentation,P2,"On 20th of May at 23:08 UTC, PYTG Support team received a notification regarding an increase in advice messages between 18:40 and 19:00.

Advanced support confirmed that transaction processing was partially affected between 18:10 and 18:23 following MOX BL Release 2.25.8-hf.3

An internal ticket has been created for further root cause investigation.",Daniel Velado,Daniel Velado,,,,Banking.Live,MOX,,,Paymentology,,,,,,,,,,,https://paymentology.atlassian.net/wiki/spaces/TS/pages/8745877846/2025-05-20+-+P2+-+Partial+Outage+of+Transaction+Processing,2025-05-20T23:16:26.227Z,2025-05-20T23:16:26.227Z,,,,,,,,,,,,,2026-02-02T15:24:02.903Z,,public,244.3,107.8,91.2,45.3,21may-p2-149-partial-outage-of-transaction-processing,https://slack.com/app_redirect?team=T03SMJWS8&channel=C08SW38219V,Reported by Daniel Velado,false
150,Partial Outage of API Processing,Service Incident,Post-Incident Tasks & Documentation,P1,"**Issue:** There was a partial outage of API processing, starting at approximately 13:50 UTC, causing API calls to receive 404 system errors and fail. Impact stopped approximately at 17:30 UTC.

**Impact:** Customers experienced a partial outage of API processing.

**Causes:** API-05 Server disconnection.

**Steps to resolve:** A conference bridge was established with the respective teams to investigate the issue, a banner was uploaded to inform clients, and API-05 server was restarted to clear out the current errors.",Daniel Velado,Daniel Velado,,,David Aragon,VoucherEngine,,,,Paymentology,https://teams.microsoft.com/l/meetup-join/19%3ameeting_OTI1M2MyNzAtZjZmNy00NWUzLWE5NzktOWY2MzM3YzAzNTU0%40thread.v2/0?context=%7b%22Tid%22%3a%224f7797e2-a59f-4381-ad8e-b81223603c9d%22%2c%22Oid%22%3a%2277fd2081-e5b3-4187-a436-a13e4cc70a0f%22%7d,,,,,,,,,,https://paymentology.atlassian.net/wiki/spaces/TS/pages/8746106896/2025-05-21+-+P1+-+Partial+Outage+of+API+Processing,2025-05-21T16:57:46.314Z,2025-05-21T16:57:46.314Z,,,,,2025-05-21T17:57:05.147Z,,2025-05-21T17:57:05.147Z,,,,,3558,2025-05-22T05:04:28.927Z,,public,213.6,183.6,20,10,21may-p1-150-partial-outage-of-api-processing,https://slack.com/app_redirect?team=T03SMJWS8&channel=C08TG6SB4NN,Reported by Daniel Velado,false
151,Partial Outage of API Processing - FlexPay,Service Incident,Post-Incident Tasks & Documentation,P1,"**Issue:** There was a partial outage of API processing for FlexPay, which began around 16:30 UTC on 21 May 2025 and was resolved by 21:18 UTC.

**Impact:** This resulted in a partial outage of API processing.

**Causes:** TBD

**Steps to resolve:** A conference bridge was established to investigate the issue, on-site development teams were able to bring the database back up, and eventually confirmed that POS and ATM transactions, along with other services, were restored.",Daniel Velado,Daniel Velado,,,,Acorn / FlexPay,,,,Paymentology,,,,,,,,,,,https://paymentology.atlassian.net/wiki/spaces/TS/pages/8748597298/2025-05-21+-+P1+-+Partial+Outage+of+API+Processing+-+FlexPay,2025-05-21T18:29:27.536Z,2025-05-21T18:29:27.536Z,,,,,2025-05-21T21:27:24.328Z,,2025-05-21T21:27:24.328Z,,,,,10676,2025-05-22T22:10:36.679Z,,public,115.3,105.3,0,10,21may-p1-151-partial-outage-of-api-processing-flexpay,https://slack.com/app_redirect?team=T03SMJWS8&channel=C08TTGLD7Q9,Reported by Daniel Velado,false
152,Partial Outage of Transaction Processing,Service Incident,Root Cause Analysis and Corrective Actions,P2,"On 23 May 2025 at 01:29 UTC, the Advanced Support team was alerted to a disconnection on a VISA Payroute instance, and around the same time, an increase in reversals from Mastercard.  Further investigation revealed 2 PR instances connecting to VISA and a PKS instance on the same data centre experienced a temporary network disconnection, causing transactions to be processed in stand-in by the schemes. A network issue in the connection to the data centre, likely on the VPN tunnel, is suspected to have caused the disconnection. By 01:37 UTC, all connections were back to normal, and transaction processing resumed without further issues.  Close monitoring post-resumption did not reveal further issues. Further investigation into the root cause is ongoing and will be shared in the Root Cause Analysis Report (RCAR).",Vicnesh Baskar,Vicnesh Baskar,,,Dominic Wee,Banking.Live,"MOX, Bank Al Etihad",,Some transactions are processing in STIP,Third-Party - Paymentology,https://teams.microsoft.com/l/meetup-join/19%3ameeting_MzAwMjA4YzQtMTI0Yi00NjQwLTkyNWEtNmZiZDRhY2Q2NGUy%40thread.v2/0?context=%7b%22Tid%22%3a%224f7797e2-a59f-4381-ad8e-b81223603c9d%22%2c%22Oid%22%3a%225bc8ffce-74fa-4e51-af76-275e9877517e%22%7d,,,,,,,,,,https://paymentology.atlassian.net/wiki/spaces/TS/pages/8749252614/2025-05-23+-+P2+-+Partial+Outage+of+Transaction+Processing,2025-05-23T02:00:39.043Z,2025-05-23T02:00:39.043Z,,,,,2025-05-23T03:27:20.927Z,2025-05-23T01:42:00.000Z,2025-05-23T03:27:20.927Z,,2025-05-23T04:57:37.497Z,,,5201,2026-02-02T15:25:36.956Z,,public,483.4,431,22.4,30,23may-p2-152-partial-outage-of-transaction-processing,https://slack.com/app_redirect?team=T03SMJWS8&channel=C08TGG9NMHC,Reported by Vicnesh Baskar,false
154,Partial Outage of Transaction Processing,Service Incident,Post-Incident Tasks & Documentation,P2,"On 25 May 2025 at 13:21 UTC, the technical team was alerted about a partial outage impacting transaction processing. Initial investigation showed that intermittent ATM/POS transaction timeouts were occurring due to insufficient hardware capacity, as the system was still operating in disaster recovery mode following a shutdown on 21 May. The system was placed into emergency maintenance from 21:00–22:00 UTC to allocate additional memory and improve performance. Transaction processing normalised after 21:56 UTC with no further issues. The issue was resolved by restoring hardware capacity via scheduled maintenance. Further updates on the root cause and preventive actions will be provided in the RCA Report (RCAR).",Vicnesh Baskar,Vicnesh Baskar,,,Tshegofatso Manakana,Acorn / FlexPay,,Restoring hardware capacity via scheduled maintenance,,Paymentology,,,,,,,,,,,https://paymentology.atlassian.net/wiki/spaces/TS/pages/8753283074/2025-05-25+-+P2+-+Partial+Outage+of+Transaction+Processing,2025-05-25T18:15:49.528Z,2025-05-25T18:15:49.528Z,,,,,2025-05-25T22:28:11.932Z,2025-05-24T18:11:00.000Z,2025-05-25T18:40:59.040Z,2025-05-25T22:28:11.932Z,,,,15142,2025-05-26T06:15:11.190Z,,public,181.6,73.3,11.8,96.5,25may-p2-154-partial-outage-of-transaction-processing,https://slack.com/app_redirect?team=T03SMJWS8&channel=C08TJ5ENXRV,Reported by Vicnesh Baskar,false
155,Partial Outage of Transaction Processing,Service Incident,Post-Incident Tasks & Documentation,P1,"On 26 May 2025 at 01:06 UTC, the Advanced Support team was alerted to the disconnection of several CRIMSON nodes (PANL, FRMN, and GIMI) from the GIM-UEMOA (local switching provider), impacting transaction processing via that route. The disconnection originated from the GIM-UEMOA side. The nodes were restored at 02:54 UTC with successful echo tests; however, transaction traffic did not resume immediately.

The switching team manually restarted the affected nodes between 13:33 and 13:38 UTC. Connectivity was confirmed as healthy, but transactions did not flow until GIM acknowledged the issue at 19:00 UTC and initiated their investigation. Transaction processing resumed at 06:09 UTC for PANL and 08:32 UTC for FRMN on 26 May. GIM were requested to provide a root cause, and further updates will be provided in the RCA Report (RCAR).",Vicnesh Baskar,Vicnesh Baskar,,,Ardiansyah Ar,VoucherEngine,"Panelys, GIM Uemoa",Automatically resolved after reconnectuon with GIM,Unable to receive any transactions from local switching provider (GIM UEMOA),Third-Party - Client,,,,,,,,,,,https://paymentology.atlassian.net/wiki/spaces/TS/pages/8756002903/2025-05-26+-+P1+-+Partial+Outage+of+Transaction+Processing,2025-05-26T01:43:59.991Z,2025-05-26T01:43:59.991Z,,,,,2025-05-27T00:39:31.984Z,2025-05-26T01:18:00.000Z,2025-05-26T04:09:29.648Z,,2025-05-26T05:45:09.465Z,,,82531,2026-02-02T15:26:22.200Z,,public,440.4,383.1,0,57.4,26may-p1-155-partial-outage-of-transaction-processing,https://slack.com/app_redirect?team=T03SMJWS8&channel=C08TZLASFJN,Reported by Vicnesh Baskar,false
