206,No transaction on VISA PR,Service Incident,Closed,P4,"VISA PR02 was restarted and transaction processing normalised after 04:08 UTC. The impact assessment is ongoing; thus far, no advisories have been observed from VISA. The issue is suspected due to an activity on VISA, ticket logged for confirmation.",Vicnesh Baskar,Vicnesh Baskar,Rahadian Pratama,,Ardiansyah Ar,Banking.Live,,Restart of VISA PR02,Partial Outage of Transaction Processing,TBD,,,,,,,,,,,,2025-07-16T04:10:45.536Z,2025-07-16T04:10:45.536Z,,,,,2025-07-16T04:46:41.528Z,,2025-07-16T04:39:13.706Z,,2025-07-16T04:48:15.801Z,,2025-07-16T04:48:15.801Z,2155,2025-07-17T08:24:20.485Z,,public,130.3,130.3,0,0,16jul-p4-206-no-transaction-on-visa-pr,https://slack.com/app_redirect?team=T03SMJWS8&channel=C095Z0ER1T7,Reported by Vicnesh Baskar,true
207,Partial Outage of Transaction Processing ,Service Incident,Post-Incident Tasks & Documentation,P3 - Critical,"Partial outage of transaction processing occurred from 09:41 UTC to 09:44 UTC. Currently transactions are processing as expected with no issues. Investigation into the root cause is ongoing, ticket has been raised to DB Team for further investigation as AS team identified Paycore DB utilization reached 100% between 09:35 to 09:40 UT.",Kaisar Mahmood,Kaisar Mahmood,,,,Banking.Live,Wio,,1 minute partial outage of transaction processing occurred from 09:41 UTC to 09:42 UTC. 88 transactions were impacted. ,Paymentology,,,,,,,,,,,https://paymentology.atlassian.net/wiki/spaces/TS/pages/8868888579/2025-07-16+-+P3+-+Critical+-+Partial+Outage+of+Transaction+Processing,2025-07-16T10:48:12.910Z,2025-07-16T10:48:12.910Z,,,,,2025-07-16T14:15:42.403Z,2025-07-16T01:41:00.000Z,2025-07-16T14:15:42.403Z,,,,,12449,2025-07-23T07:55:01.527Z,,public,235.5,163.7,71.8,0,16jul-p3-critical-207-partial-outage-of-transaction-processing,https://slack.com/app_redirect?team=T03SMJWS8&channel=C095YML3TRU,Reported by Kaisar Mahmood,false
208,Partial Outage of Transaction Processing,Service Incident,Closed,P2,"On 17 July 2025 at 04:38 UTC, the Technical Team was alerted about service disruptions via multiple monitoring alerts. Initial investigation showed that some transactions between 04:32 UTC to 04:35 UTC were experiencing timeouts, caused by a blocking query in the database

The issue was resolved automatically after 04:35 UTC since the blocking query completed execution. Transaction processing normalised thereafter, with no further transaction failures observed. Internal teams are involved in a detailed investigation. Additional updates on the root cause and preventive actions will be provided in the RCA Report (RCAR).",Vicnesh Baskar,Vicnesh Baskar,Heru Nugroho,,Ardiansyah Ar,VoucherEngine,,Blocking query completed execution,,Paymentology,,,,,,,,,,,https://paymentology.atlassian.net/wiki/spaces/TS/pages/8857780234/2025-07-17+-+P2+-+Partial+Outage+of+Transaction+Processing,2025-07-17T05:14:03.926Z,2025-07-17T05:14:03.926Z,,,,,,,,,2025-07-17T07:06:07.943Z,2025-08-04T23:30:48.210Z,2025-08-04T23:30:48.210Z,,2026-02-02T16:33:44.260Z,,public,146.5,146.5,0,0,17jul-p2-208-partial-outage-of-transaction-processing,https://slack.com/app_redirect?team=T03SMJWS8&channel=C096VP5MUKA,Reported by Vicnesh Baskar,false
209,Partial Outage of Transaction Processing,Service Incident,Closed,P4,"Investigating a partial impact on ISB transactions, started at 14:42 UTC.
PYTG Network and Application were working as intended.
ISB confirmed an issue on their end an impact stopped as of 16:38 UTC",Daniel Velado,Daniel Velado,,,,Banking.Live,Islandsbanki,,,,,,,,,,,,,,,2025-07-17T15:38:44.712Z,2025-07-17T15:38:44.712Z,,,,,2025-07-17T16:45:20.990Z,,2025-07-17T16:45:20.990Z,,,,2025-07-17T16:45:20.990Z,3996,2025-07-17T16:45:21.126Z,,public,309.5,275.1,0,34.4,17jul-p4-209-partial-outage-of-transaction-processing,https://slack.com/app_redirect?team=T03SMJWS8&channel=C0966U2NXEJ,Reported by Daniel Velado,false
210,Partial Outage of Transaction Processing,Service Incident,Post-Incident Tasks & Documentation,P1,"Investigating advice messages on sh02.
Begin: 15:01:30
End: 15:44:00",Daniel Velado,Daniel Velado,,,,Banking.Live,,,,Paymentology,,,,,,,,,,,https://paymentology.atlassian.net/wiki/spaces/TS/pages/8861811170/2025-07-18+-+P1+-+Partial+Outage+of+Transaction+Processing,2025-07-18T16:31:00.844Z,2025-07-18T16:31:00.844Z,,,,,,,,,,,,,2026-02-02T16:34:24.368Z,,public,839.1,595,224,20.2,18jul-p1-210-partial-outage-of-transaction-processing,https://slack.com/app_redirect?team=T03SMJWS8&channel=C096DAKGGLE,Reported by Daniel Velado,false
211,Full Outage of Transaction Processing,Service Incident,Root Cause Analysis and Corrective Actions,P1,"On 19 July 2025 at 01:13 UTC, the client reported that VISA transactions were being processed in STIP. Initial investigation revealed that while the systems were operational, transactions were being processed in stand-in mode between 00:07 UTC to 00:39 UTC. Both PayPower and PayRoute instances were proactively restarted, and on further investigation, it was observed that there was a connectivity error with VISA, which automatically resolved without any manual intervention.

Further investigation from the relevant teams is ongoing to determine the underlying cause. Updates on root cause and preventive actions will be provided in the RCA Report (RCAR).",Vicnesh Baskar,Vicnesh Baskar,,,Jenifer Cachero,Banking.Live,D360,Automatically resolved without any manual intervention.,,Paymentology,,,,,,,,,,,https://paymentology.atlassian.net/wiki/spaces/TS/pages/8862073502/2025-07-21+-+P1+-+Full+Outage+of+Transaction+Processing,2025-07-21T01:25:56.936Z,2025-07-21T01:25:56.936Z,,,,,,,,,2025-07-21T06:50:15.199Z,,,,2025-07-21T06:53:19.102Z,,public,221.8,205.5,0,16.3,21jul-p1-211-full-outage-of-transaction-processing,https://slack.com/app_redirect?team=T03SMJWS8&channel=C0967TXHDD5,Reported by Vicnesh Baskar,false
212,Full Outage of Transaction Processing,Service Incident,Root Cause Analysis and Corrective Actions,P1,"On 20 July 2025 at 07:27 UTC, the monitoring team detected a disconnection on nodes prod_goty_6b and prod_goty_6c connecting to Bancnet, causing a full outage of transaction processing. Initial investigation showed port monitor failures. The systems were restored at 07:54 UTC, and transaction processing normalised thereafter with no further issues.

Bancnet later confirmed that the PLDT VPN tunnel, a local service provider, went down, causing the disconnection between Paymentology and Bancnet. PLDT has been contacted for further details, alongside an ongoing investigation by the internal Network team. Updates on root cause and preventive actions will be provided in the RCA Report (RCAR).",Vicnesh Baskar,Vicnesh Baskar,Heru Nugroho,,Wilson Keneshiro,VoucherEngine,GoTyme,No manual intervention,,Third-Party - Paymentology,,,,,,,,,,,https://paymentology.atlassian.net/wiki/spaces/TS/pages/8863645707/2025-07-21+-+P1+-+Full+Outage+of+Transaction+Processing+1,2025-07-21T02:05:12.566Z,2025-07-21T02:05:12.566Z,,,,,,,,,2025-07-21T07:05:32.046Z,,,,2026-02-02T16:35:30.186Z,,public,71.5,71.5,0,0,21jul-p1-212-full-outage-of-transaction-processing,https://slack.com/app_redirect?team=T03SMJWS8&channel=C096KKKMQPQ,Reported by Vicnesh Baskar,false
213,Outage of Transaction & API Processing ,Service Incident,Post-Incident Tasks & Documentation,P1,"• Transaction and APIs are processing as expected from 14:04 UTC  21st July. Issue auto resolved, no action was taken by PYTG support team to resolve the issue.

• Investigation to determine the root cause is ongoing.",Kaisar Mahmood,Kaisar Mahmood,,,,Banking.Live,Bank Al Etihad,"Issue auto resolved, no action was taken by PYTG support team to resolve the issue.",Transaction and API processing ,Paymentology,https://teams.microsoft.com/l/meetup-join/19%3ameeting_ZDRkYzFjMTktOTNiNy00ZjhhLThiZTktMTE4ZWUxYjNmMzQ0%40thread.v2/0?context=%7b%22Tid%22%3a%224f7797e2-a59f-4381-ad8e-b81223603c9d%22%2c%22Oid%22%3a%22d48a7985-ef95-4c3b-8394-cfba4ea3afbb%22%7d,,,,,,,,,,https://paymentology.atlassian.net/wiki/spaces/TS/pages/8863744347/2025-07-21+-+P1+-+Outage+of+Transaction+API+Processing,2025-07-21T14:32:35.660Z,2025-07-21T14:32:35.660Z,,,,,2025-07-21T14:57:46.631Z,2025-07-21T05:55:00.000Z,2025-07-21T14:57:46.631Z,,,,,1510,2026-02-02T16:36:10.350Z,,public,543.4,368.9,138.2,36.4,21jul-p1-213-outage-of-transaction-api-processing,https://slack.com/app_redirect?team=T03SMJWS8&channel=C096NFUV39U,Reported by Kaisar Mahmood,false
214,Partial Outage of Transaction Processing,Service Incident,Root Cause Analysis and Corrective Actions,P1,"On 22 July 2025 at 06:46 UTC, the Application Support team was alerted via monitoring tools on latency issues impacting Crimson response time and transaction processing. Initial investigation revealed multiple long-running queries, causing the latency. 

The queries were killed, and web servers were restarted to clear any stuck queries. By 07:21 UTC, transaction processing had normalised. The Application and Database team is currently engaged in a root cause investigation, and further updates will be shared through the Root Cause Analysis Report (RCAR).",Vicnesh Baskar,Vicnesh Baskar,,,Alaa Wehbe,VoucherEngine,,Killed long running queries and web server restart,,Paymentology,,,,,,,,,,,https://paymentology.atlassian.net/wiki/spaces/TS/pages/8865349799/2025-07-22+-+P1+-+Partial+Outage+of+Transaction+Processing,2025-07-22T07:04:38.595Z,2025-07-22T07:04:38.595Z,,,,,2025-07-22T07:54:09.638Z,,2025-07-22T07:54:09.638Z,,2025-07-30T23:57:35.408Z,,,2971,2025-07-30T23:57:35.823Z,,public,440.6,430.6,10,0,22jul-p1-214-partial-outage-of-transaction-processing,https://slack.com/app_redirect?team=T03SMJWS8&channel=C096SNCD7U6,Reported by Vicnesh Baskar,false
215,Intermittent Transaction Processing Outage,Service Incident,Post-Incident Tasks & Documentation,P3 - Critical,"Mastercard reported transaction processing issues on BIN 557377 (C24). Internal monitoring confirmed disconnections between `payroute-mc-sharedeu-c24-2bv-6500` and Mastercard, observed multiple times. PagerDuty alerts noted IPS timeout and socket disconnection in SH EU.

Internal bridge has been established for an investigation",Snothile Dlamini,Snothile Dlamini,Mauro Merino,,Kamal Thapa,Banking.Live,C24,Service restart,,Paymentology,https://teams.microsoft.com/l/meetup-join/19%3ameeting_NTRkMGQ3N2MtOWM2Ny00MGM1LThkYWMtM2QxNDczODJkYTE2%40thread.v2/0?context=%7b%22Tid%22%3a%224f7797e2-a59f-4381-ad8e-b81223603c9d%22%2c%22Oid%22%3a%22067d56db-044f-4b5b-b44c-8303c87625ab%22%7d,,,,,,,,,,https://paymentology.atlassian.net/wiki/spaces/TS/pages/8866758728/2025-07-22+-+P2+-+Intermittent+Transaction+Processing+Outage,2025-07-22T15:06:31.078Z,2025-07-22T15:06:31.078Z,,,,,2025-07-22T15:34:01.401Z,2025-07-22T13:26:00.000Z,2025-07-22T15:34:01.401Z,,,,,1650,2025-07-23T15:05:11.115Z,,public,524,420.8,103.2,0,22jul-p3-critical-215-intermittent-transaction-processing-outage,https://slack.com/app_redirect?team=T03SMJWS8&channel=C096V9Q3NMC,Reported by Snothile Dlamini,false
216,Full Outage of JONET Transaction Processing,Service Incident,Closed,P3 - Critical,"On 22 July 2025 at 23:08 UTC, the team was alerted about a disconnection issue related to Cortex on host `pt-boj-proute01.paymentology.org`. The initial investigation revealed that a socket disconnection occurred at 23:11:03 UTC, which was auto-reconnected by 23:11:08 UTC. However, despite reconnection, no transactions were processed until a manual restart of the Jonet PayRoute was done. The PayRoute Jonet system was restarted at 07:38 UTC on 23 July 2025, and transaction processing normalised after 23:37:53 UTC with no further issues.",Vicnesh Baskar,Vicnesh Baskar,,,Jenifer Cachero,Banking.Live,Bank of Jordan,Manual restart of the Jonet PayRoute,,Paymentology,,,,,,,,,,,https://paymentology.atlassian.net/wiki/spaces/TS/pages/8867971188/2025-07-23+-+P3+-+Critical+-+Full+Outage+of+JONET+Transaction+Processing,2025-07-23T00:41:17.443Z,2025-07-23T00:41:17.443Z,,,,,,,,,2025-07-23T00:43:40.403Z,,2025-07-23T00:43:40.403Z,,2026-02-02T16:37:48.912Z,,public,116.8,86.8,0,30,23jul-p3-critical-216-full-outage-of-jonet-transaction-processing,https://slack.com/app_redirect?team=T03SMJWS8&channel=C097EAP281F,Reported by Vicnesh Baskar,true
218,Partial Outage of Transaction Processing ,Service Incident,Post-Incident Tasks & Documentation,P3 - Critical,"• No Spike of memory utilization after ECR implementation (on 25th July) for C24, NOMO, UW, and Snappi.

• AS team to monitor closely and if any server shows critically low free memory, PayRoute will be proactively restarted to prevent any outage. MOX is high volume client that will be monitored extra closely.

• Additional memory (leak) alerting was implemented on 25th July.

• We will look to deploy the ECR to the remaining Environments / Clients this week. Service Delivery team will plan accordingly – Exact date/times to TBC.

 ",Kaisar Mahmood,Kaisar Mahmood,,,,Banking.Live,C24,ECR Implemented,Partial Outage of Transaction Processing ,Paymentology,https://teams.microsoft.com/l/meetup-join/19%3ameeting_MDc5MDc2MDEtYWQwMy00NTRhLWFkMDAtYTRhY2Q4NGE4Njdk%40thread.v2/0?context=%7b%22Tid%22%3a%224f7797e2-a59f-4381-ad8e-b81223603c9d%22%2c%22Oid%22%3a%22d48a7985-ef95-4c3b-8394-cfba4ea3afbb%22%7d,,,,,,,,,,https://paymentology.atlassian.net/wiki/spaces/TS/pages/8883863597/2025-07-25+-+P3+-+Critical+-+Partial+Outage+of+Transaction+Processing,2025-07-25T13:02:05.052Z,2025-07-25T13:02:05.052Z,,,,,2025-07-28T07:44:29.208Z,2025-07-25T04:26:00.000Z,2025-07-28T07:44:29.208Z,,,,,240144,2025-07-31T08:05:11.833Z,,public,504.3,339.6,89.1,75.6,25jul-p3-critical-218-partial-outage-of-transaction-processing,https://slack.com/app_redirect?team=T03SMJWS8&channel=C097BRCMDQT,Reported by Kaisar Mahmood,false
219,Full Outage Of Transaction and API Processing,Service Incident,Post-Incident Tasks & Documentation,P1,"On 30 July 2025 at 12:17 UTC, we experienced a full outage affecting transaction processing and API services. All TRN clusters, as well as supporting Web and API components, went down simultaneously. This resulted in HTTP 503 errors and a complete halt to transaction activity across the platform.

Recovery required a coordinated restart of ColdFusion services across multiple servers. Web services came back first, followed by transaction and API clusters. By the end of the bridge, all components were back online, and transaction traffic had resumed. 

The exact root cause of the outage is still under investigation.",Snothile Dlamini,Snothile Dlamini,,,,VoucherEngine,,,,Paymentology,,,,,,,,,,,https://paymentology.atlassian.net/wiki/spaces/TS/pages/8882159852/2025-07-30+-+P1+-+Transaction+Processing+Outage,2025-07-30T12:39:45.349Z,2025-07-30T12:39:45.349Z,,,,,2025-07-30T13:16:15.793Z,,2025-07-30T13:16:15.793Z,,,,,2190,2025-07-30T13:28:55.215Z,,public,549.4,549.4,0,0,30jul-p1-219-full-outage-of-transaction-and-api-processing,https://slack.com/app_redirect?team=T03SMJWS8&channel=C097Q7C6QGP,Reported by Snothile Dlamini,false
220,Full Outage of Transaction Processing,Service Incident,Root Cause Analysis and Corrective Actions,P1,"The AFS scheme is disconnected and is refusing reconnection. PR restarted, further investigation underway. A ticket has been logged to AFS for support as well.",Vicnesh Baskar,Vicnesh Baskar,Rahadian Pratama,,Dominic Wee,Banking.Live,Dopay LLC,Reconnection with scheme AFS,Full Outage of Transaction Processing,Third-Party - Client,,,,,,,,,,,https://paymentology.atlassian.net/wiki/spaces/TS/pages/8892645403/2025-08-05+-+P1+-+Full+Outage+of+Transaction+Processing,2025-08-05T01:50:37.138Z,2025-08-05T01:50:37.138Z,,,,,2025-08-05T02:07:41.678Z,,2025-08-05T02:07:41.678Z,,2025-08-05T04:10:10.590Z,,,1024,2026-02-02T16:41:44.589Z,,public,305.6,273.1,32.5,0,05aug-p1-220-full-outage-of-transaction-processing,https://slack.com/app_redirect?team=T03SMJWS8&channel=C098UC48S2F,Reported by Vicnesh Baskar,false
221,Transaction Processing Outage,Service Incident,Post-Incident Tasks & Documentation,P1,"On 5 August 2025, a partial transaction processing outage occurred, with multiple Crimson alerts and increased 9XXX declines observed. The issue was linked to one of the transaction routing nodes (TRN-02), which was removed from the cluster and restarted. This action successfully restored normal transaction flow, with the last errors observed at 10:20 AM UTC. Service has remained stable since, and root cause investigations are ongoing.",Snothile Dlamini,Snothile Dlamini,,,,VoucherEngine,,,,Paymentology,,,,,,,,,,,https://paymentology.atlassian.net/wiki/spaces/TS/pages/8892874821/2025-08-05+-+P1+-+Transaction+Processing+Outage,2025-08-05T10:14:36.285Z,2025-08-05T10:14:36.285Z,,,,,2025-08-05T10:45:00.644Z,2025-08-05T10:00:00.000Z,2025-08-05T10:45:00.644Z,,,,,1824,2025-08-05T10:45:17.093Z,,public,449.1,377.6,52.2,19.4,05aug-p1-221-transaction-processing-outage,https://slack.com/app_redirect?team=T03SMJWS8&channel=C099FSKH02V,Reported by Snothile Dlamini,false
223,Incorrect Settlement Mapping,Service Incident,Fixing,P1,"MOX escalated a critical issue involving incorrect settlement postings caused by duplicate ECNO values assigned to different tokens. Investigation revealed that:

• Tokens were created via the `create_card` API at nearly the same timestamp.

• Both tokens share the same PAN and CVV, and originate from the same _perso_ file.

• The duplicate ECNOs caused the settlement system to misroute funds based on matching fields (DE38 and DE63), resulting in charges applied to the wrong customer.

The issue appears to originate from a race condition or logic flaw within the `stackfill` process or PayKeyServ ECNO generation, possibly tied to previous unresolved defects (e.g., DEFECT-415, DEFECT-147). Although a fix had been deployed earlier, older tokens or regression could be responsible.

Incident is now being proactively handled as a P1 based on MOX escalation.",Snothile Dlamini,Snothile Dlamini,,,,Banking.Live,MOX,,,Paymentology,,,,,,,,,,,https://paymentology.atlassian.net/wiki/spaces/TS/pages/8911585324/2025-08-07+-+P1+-+Incorrect+Settlement+Mapping,2025-08-07T10:23:35.994Z,2025-08-07T10:23:35.994Z,,,,,,2025-08-04T02:09:00.000Z,2025-08-07T14:04:42.645Z,,,,,,2026-02-02T16:43:35.515Z,,public,2613.4,2143.8,365.3,104.2,07aug-p1-223-incorrect-settlement-mapping,https://slack.com/app_redirect?team=T03SMJWS8&channel=C099G596THA,Reported by Snothile Dlamini,false
224,Acorn AWS Migration,Service Incident,Investigating,P3 - Critical,Channel regarding Acorn AWS migration deployment.,Daniel Velado,Daniel Velado,,,,Acorn / FlexPay,,,,Paymentology,https://teams.microsoft.com/l/meetup-join/19%3ameeting_NjE2YjIxYTItNmUwMi00Mjg5LWJjZTYtODQ4N2YyMzMyNDQ4%40thread.v2/0?context=%7b%22Tid%22%3a%224f7797e2-a59f-4381-ad8e-b81223603c9d%22%2c%22Oid%22%3a%2277fd2081-e5b3-4187-a436-a13e4cc70a0f%22%7d,,,,,,,,,,,2025-08-11T20:10:54.495Z,2025-08-11T20:10:54.495Z,,,,,,,2025-08-13T08:00:26.550Z,,,,,,2026-02-02T16:45:29.291Z,,public,950.6,572.2,42.3,336,11aug-p3-critical-224-acorn-aws-migration,https://slack.com/app_redirect?team=T03SMJWS8&channel=C09A9SH455F,Reported by Daniel Velado,false
225,Partial Outage of Transaction Processing,Service Incident,Closed,P3 - Critical,"On August 13, 2025, at 05:29 UTC, the team was alerted to delays in authorisations and advisements from multiple clients. Initial investigation showed that responses from the Mastercard scheme were delayed before being delivered to the respective PayRoutes. The Mastercard cloud MIPS system appeared to delay transaction delivery, causing timeouts across multiple clients.

The issue was confirmed to be outside the platform, and a support case was raised with Mastercard for investigation. Transaction processing normalised post 05:32UTC with no further delays observed. The issue was escalated to Mastercard, and a deeper investigation is underway",Vicnesh Baskar,Vicnesh Baskar,Rahadian Pratama,,Abdul Sahaptheen,Banking.Live,"Mettle, MOX, Islandsbanki, Wio, Bank of Jordan",N/A,,Inconclusive,,,,,,,,,,,https://paymentology.atlassian.net/wiki/spaces/TS/pages/8964276268/2025-08-13+-+P3+-+Critical+-+Partial+Outage+of+Transaction+Processing,2025-08-13T08:04:13.458Z,2025-08-13T08:04:13.458Z,,,,,,,,,,,2025-08-13T08:04:13.458Z,,2026-02-02T16:50:03.731Z,,public,604.2,448.4,74.1,81.6,13aug-p3-critical-225-partial-outage-of-transaction-processing,https://slack.com/app_redirect?team=T03SMJWS8&channel=C099ZL4FPR9,Reported by Vicnesh Baskar,false
227,Partial Outage of Transaction Processing,Service Incident,Post-Incident Tasks & Documentation,P2,"On 16 August 2025 at 16:56 UTC, the support team was alerted to high latency on multiple Crimson instances. The team began investigating immediately and identified timeouts occurring during XML-RPC method calls, such as `deductauth` and `balance`. The issue was resolved at 16:58 UTC as latency levels dropped and transactions processing normalised.

A subsequent analysis showed that blocking queries on the database during the incident window were the likely cause of the latency and timeout errors. Further investigation into the root cause is currently underway and and further updates will be provided in the root cause analysis report (RCAR).",Vicnesh Baskar,Vicnesh Baskar,William Perez,,David Aragon,VoucherEngine,,Auto-resolved,,Paymentology,,,,,,,,,,,https://paymentology.atlassian.net/wiki/spaces/TS/pages/8915550253/2025-08-17+-+P2+-+Partial+Outage+of+Transaction+Processing,2025-08-17T02:49:01.498Z,2025-08-17T02:49:01.498Z,,,,,,,,,,,,,2026-02-02T16:46:04.027Z,,public,116.5,104.1,12.4,0,17aug-p2-227-partial-outage-of-transaction-processing,https://slack.com/app_redirect?team=T03SMJWS8&channel=C09BGP13V6U,Reported by Vicnesh Baskar,false
228,Full Outage of Transaction Processing,Service Incident,Closed,P4,"On 17 August 2025 at 10:33 UTC, the support team was alerted about a full outage of transaction processing, impacting VISA and MADA schemes. Initial investigation showed high CPU utilisation on the PaycoreDB node and complete failure of transaction processing on affected services. The PayPower services were restarted, but failed to restore transaction processing.

The client confirmed their core banking system was experiencing issues, and at 11:37 UTC, all PayRoutes (PRs) were stopped in response to a client request, disconnecting from the schemes. Recovery activities began at 12:20 UTC once the client confirmed their systems were restored.

At 13:00, both schemes were successfully reconnected, and no further response failures were observed. Resource utilisation normalised following the completion of advisement processing. Client has confirmed that transaction processing has normalised.",Vicnesh Baskar,Vicnesh Baskar,Rasheed Khan,,Suganya Eswaran,Banking.Live,D360,Fix of client side technical failure,Full outage of VISA transaction processing,Client,https://teams.microsoft.com/l/meetup-join/19%3ameeting_ZjExZTUzZTgtMTU4Ny00NDc3LTgwYzMtYWMxOGY0MTAwNmZj%40thread.v2/0?context=%7b%22Tid%22%3a%224f7797e2-a59f-4381-ad8e-b81223603c9d%22%2c%22Oid%22%3a%225bc8ffce-74fa-4e51-af76-275e9877517e%22%7d,,,,,,,,,,,2025-08-17T10:59:02.982Z,2025-08-17T10:59:02.982Z,,,,,2025-08-17T13:40:42.791Z,,2025-08-17T11:54:30.994Z,2025-08-17T13:40:42.791Z,2025-08-20T08:23:34.188Z,,2025-08-20T08:23:34.188Z,9699,2025-08-20T08:23:34.319Z,,public,909.9,526.5,304.2,79.2,17aug-p4-228-full-outage-of-transaction-processing,https://slack.com/app_redirect?team=T03SMJWS8&channel=C09AUGTK60L,Reported by Vicnesh Baskar,true
229,Partial Outage of Transaction Processing,Service Incident,Post-Incident Tasks & Documentation,P4,"On 17 August 2025 at 15:00 UTC, the team was alerted about FAST authorisation transaction failures on the client instance. Initial investigation showed approximately 1500 transactions were impacted, with monitoring indicating high CPU usage and later high disk utilisation on the Paycore DB server.

Intermittent FAST API response failures caused elevated queuing, which impacted DB performance. Around 00:14 UTC, disk usage reached 95%, driven by excessive log file growth. Logging was observed to be triggered by transactions with longer query times—transactions that usually took milliseconds were now exceeding 1 second. No internal changes were confirmed to have caused this behaviour.

At 00:30 UTC, logging was reduced to capture only errors, resulting in decreased CPU usage. By 00:43 UTC, transaction processing had stabilised without timeouts. The tactical fix identified was to increase disk space on the Paycore DB server. Access has been requested from the client to proceed, and the infra team is on standby to execute the disk expansion.",Vicnesh Baskar,Vicnesh Baskar,Jhonatan Roldan Tavera,,Kevin Valle,,D360,Temporarily cleared space from the database server,,Paymentology,,,,,,,,,,,,2025-08-17T17:38:56.152Z,2025-08-17T17:38:56.152Z,,,,,,,,,,,,,2025-08-26T12:34:17.273Z,,public,362.2,256.7,29.6,75.9,17aug-p4-229-partial-outage-of-transaction-processing,https://slack.com/app_redirect?team=T03SMJWS8&channel=C09ARDA6T5Y,Reported by Vicnesh Baskar,false
